Year,App ID,Top Free Number,Top Free Different,Top Free Name,Top Free Publisher,Top Free Tags,Top Free Downloads,Top Grossing Number,Top Grossing Different,Top Grossing Name,Top Grossing Publisher,Top Grossing Tags,Top Grossing Revenue
2015,103425,1,,B612 AI Photo&Video Editor,SNOW Corporation,,100000000,1,,Facetune AI Photo/Video Editor,Lightricks Ltd.,,10000000
2015,86762,2,,iMovie,Apple,,100000000,2,,VSCO: Photo & Video Editor,Visual Supply Company,,5000000
2015,241404,3,,Dubsmash - Videos for everyone,reddit,,100000000,3,,Magisto Video Editor & Maker,"Vimeo, Inc.",,5000000
2015,22778,4,,Retrica-Original Filter Camera,"Retrica, Inc.",,50000000,4,,LINE Camera - Photo editor,LINE Corporation,,2000000
2015,7828588,5,,Camera360-Selfie Editor,灏 徐,,50000000,5,,"Quik – Free Video Editor for photos, clips, music","GoPro, Inc.",,2000000
2015,115321,6,,"Picsart AI Photo Editor, Video","PicsArt, Inc.",,50000000,6,,Afterlight,"Afterlight Collective, Inc",,2000000
2015,202550,7,,"PhotoGrid: Video & Pic Collage Maker, Photo Editor",Cheetah Technology Corporation Limited,,50000000,7,,iMovie,Apple,,2000000
2015,233375,8,,Layout from Instagram,Instagram,,50000000,8,,Video Star,Frontier Design Group,,2000000
2015,238089,9,,VivaVideo - Video Editor&Maker,QuVideo Inc. Video Editor & Video Maker App,,50000000,9,,FxGuru:  Movie FX Director,Picadelic,,2000000
2015,1317383,10,,YouCam Makeup - Selfie Editor,PERFECT MOBILE CORP.,,50000000,10,,Cute CUT,波 余,,2000000
2015,130262,11,,BeautyPlus-AI Photo/Video Edit,Pixocial Technology Singapore Pte Ltd,,50000000,11,,ElfYourself®,Magic Mirror LLC,,2000000
2015,9505428,12,,Candy Camera - photo editor,Studio SJ,,50000000,12,,"Picsart AI Photo Editor, Video","PicsArt, Inc.",,1000000
2015,111380,13,,Photo Editor Pro,Zentertain,,20000000,13,,"MOLDIV - Photo Editor, Collage",JellyBus Inc.,,1000000
2015,6097234,14,,Photo Collage Editor,Zentertain,,20000000,14,,Videoshop - Video Editor,Jajijujejo Inc.,,1000000
2015,108879,15,,PIP Camera Pro.,"Fotoable, Inc.",,20000000,15,,Perfect365 Makeup Photo Editor,"Perfect365, Inc.",,1000000
2015,626659,16,,BeautyCam - Beautify & AI Art,"Xiamen Meitu Technology Co., Ltd.",,20000000,16,,Word Swag - Cool Fonts,Oringe Inc.,,1000000
2015,229652,17,,Cymera - Photo Editor Collage,SK Communications,,20000000,17,,Photo Scan App by Photomyne,Photomyne LTD,,1000000
2015,115062,18,,FotoRus -Camera & Photo Editor,"Fotoable, Inc.",,20000000,18,,"Perfect Video Editor, Collage",银峰 汤,,500000
2015,225816,19,,Meitu- Photo Editor & AI Art,"Xiamen Meitu Technology Co., Ltd.",,20000000,19,,PicCollage: AI Collage Maker,Cardinal Blue,,500000
2015,532019,20,,Photo Collage Maker & Editor,Lyrebird Studio,,20000000,20,,VivaVideo - Video Editor&Maker,QuVideo Inc. Video Editor & Video Maker App,,500000
2015,235066,21,,InstaSize AI Photo Editor＋Crop,Instasize Inc.,,20000000,21,,Photo Editor by Aviary,Aviary,,500000
2015,97440,22,,LINE Camera - Photo editor,LINE Corporation,,20000000,22,,GoDaddy Studio (Over): Design,GoDaddy Mobile LLC,,500000
2015,7496315,23,,YouCam Perfect: Beauty Camera,PERFECT MOBILE CORP.,,20000000,23,,Retrica-Original Filter Camera,"Retrica, Inc.",,500000
2015,10923300,24,,PicCollage: AI Collage Maker,Cardinal Blue,,20000000,24,,Photo Editor,"Maple Media, LLC",,500000
2015,15837,25,,VSCO: Photo & Video Editor,Visual Supply Company,,20000000,25,,Stop Motion Studio,Cateater,,500000
2015,10569247,26,,InstaMag - Photo Collage Maker,"Fotoable, Inc.",,20000000,26,,Pic Stitch - Collage Editor,"Maple Media, LLC",,500000
2015,218314,27,,Video Maker Music Video Editor,VIDEOSHOW Video Editor & Maker & AI Chat Generator,,20000000,27,,Logo Maker | Design Creator.,Logo Maker LLC,,200000
2015,8100870,28,,Photo Editor by Aviary,Aviary,,20000000,28,,KineMaster-Video Editor&Maker,"KineMaster, Video Editor Experts Group",,200000
2015,225382,29,,Photoshop Express Photo Editor,Adobe,,20000000,29,,Funimate Video & Motion Editor,Pixery Bilgi Teknolojileri,,200000
2015,14090,30,,Pitu - Best selfie and PS Soft,Shenzhen Tencent Tianyou Technology Ltd,,20000000,30,,Photoshop Express Photo Editor,Adobe,,200000
2015,73432,31,,Square InPic - Photo Editor & ,Studio 8 Apps,,20000000,31,,Visage: airbrush photo maker,Linerock Investments LTD,,200000
2015,457347,32,,Meipai,"Xiamen Meitu Technology Co., Ltd.",,10000000,32,,Photo Studiо,KVADGroup App Studio,,200000
2015,8013276,33,,Vigo Video,BYTEMOD PTE.Ltd,,10000000,33,,Music Maker JAM: Beatmaker app,Loudly,,200000
2015,5137475,34,,Video Editor - Video Maker,FUNVIDEOAPP STUDIO,,10000000,34,,Color Pop: Photo Changer,Kite Games Studio Ltd,,200000
2015,220601,35,,InstaBeauty - Makeup Camera!,"Fotoable, Inc.",,10000000,35,,Split Pic Collage Maker Layout,"Easy Tiger Apps, LLC.",,200000
2015,219462,36,,Magisto Video Editor & Maker,"Vimeo, Inc.",,10000000,36,,Photo Editor-,Axiem Systems,,200000
2015,218649,37,,Snapseed,Google LLC,,10000000,37,,Phonto - Text on Photos,youthhr,,200000
2015,6051507,38,,Photo Editor Collage: Picsa,Lyrebird Studio,,10000000,38,,Glitché: Photo & Video Editor,Glitche Ltd.,,200000
2015,880451,39,,Perfect365 Makeup Photo Editor,"Perfect365, Inc.",,10000000,39,,1 Second Everyday Diary,"1 Second Everyday, P.B.C.",,200000
2015,7726691,40,,Pixlr – Photo Editor,Pixlr,,10000000,40,,TouchRetouch,ADVA Soft GmbH,,200000
2015,88755,41,,FaceArt: Filters for Pictures,Lyrebird Studio,,10000000,41,,Jane - Collage & Video design,"Shanghai Ruishixinyan Information Technology Co., Ltd",,200000
2015,45696,42,,PhotoGrid: Video Collage Maker,"KS Mobile, Inc.",,10000000,42,,PicPlayPost: Video Editor,Mixcord Inc.,,200000
2015,7739383,43,,Vigo Video -Tell your story,TikTok Pte. Ltd.,,10000000,43,,Vigo Video -Tell your story,TikTok Pte. Ltd.,,200000
2015,8038188,44,,MomentCam Cartoons & Stickers,Eureka Studios,,10000000,44,,Retouch Me: Body & Face Editor,Good Retouch LP,,200000
2015,152970,45,,MakeupPlus - Virtual Makeup,"Xiamen Meitu Technology Co., Ltd.",,10000000,45,,Collage Maker - LiveCollage,VIDEO EDITOR PTE. LTD.,,200000
2015,384488,46,,Fotor AI Photo Editor,"Chengdu Everimaging Science and Technology Co., Ltd",,10000000,46,,Fotor AI Photo Editor,"Chengdu Everimaging Science and Technology Co., Ltd",,200000
2015,85667,47,,Photo Warp,PWA STUDIO,,10000000,47,,Baby Pics - Photo Editor,Baby Pics,,200000
2015,386842,48,,Instasquare Photo Editor: Neon,Lyrebird Studio,,10000000,48,,Mega Photo: Real-Time Effects,Falstad.com,,200000
2015,83455,49,,Photo Frames: Hoarding & Photo,Studioapps,,10000000,49,,Square Sized,Daneco Ltd.,,200000
2015,6063791,50,,Video Editor & Maker - InShot,InShot Inc.,,10000000,50,,Photo Collage Maker PicJointer,"Easy Tiger Apps, LLC.",,200000
2015,108478,51,,No Crop & Square for Instagram,RILEY CILLIAN,,10000000,51,,Darkroom: Photo & Video Editor,Bergen Co.,,100000
2015,113024,52,,Cut Paste Photos,Dexati,,10000000,52,,Brushstroke,Code Organa,,100000
2015,7998923,53,,Smart Voice Recorder,SmartMob,,10000000,53,,PowerDirector - Video Editor,Cyberlink Corp,,100000
2015,6784141,54,,Scoompa Video: Slideshow Maker,Scoompa,,10000000,54,,Mixoo:Pic Collage&Grid Maker,"Xi'an Button Software Technology Co., Ltd.",,100000
2015,228061,55,,Photo Studiо,KVADGroup App Studio,,10000000,55,,Typorama: Text on Photo Editor,App Business Ventures LLC,,100000
2015,206341,56,,Phonto - Text on Photos,youthhr,,10000000,56,,Vizmato: Video Editor & Maker,Global Delight Technologies Pvt. Ltd,,100000
2015,106718,57,,Photo Lab Picture Editor & Art,Linerock Investments LTD,,10000000,57,,"Bazaart: Design, Photo & Video",Bazaart Ltd.,,100000
2015,10285678,58,,Photo Editor-,Axiem Systems,,10000000,58,,"VLLO, My First Video Editor",vimosoft,,100000
2015,231093,59,,Photo Editor & Collage Maker,Pixels Dev Studio,,10000000,59,,TADAA – Camera Focus & Depth,menschmaschine Publishing GmbH,,100000
2015,10554396,60,,Change Hair And Eye Color,Csmartworld,,10000000,60,,Video Maker Music Video Editor,VIDEOSHOW Video Editor & Maker & AI Chat Generator,,100000
2015,8675025,61,,GoPro Quik: Video Editor,"GoPro, Inc.",,5000000,61,,WavePad Audio Editor,NCH Software,,100000
2015,568521,62,,PosterLabs,"Xiamen Meitu Technology Co., Ltd.",,5000000,62,,Legend - Animate Text in Video & GIF,Stupeflix,,100000
2015,218651,63,,Pencil Sketch,Dumpling Sandwich Software Inc.,,5000000,63,,Vont - Text on Videos,youthhr,,100000
2015,8426256,64,,"MOLDIV - Photo Editor, Collage",JellyBus Inc.,,5000000,64,,Mematic - The Meme Maker,Theodor Mueller,,100000
2015,7318431,65,,Blur Background Photo Editor,Pixels Dev Studio,,5000000,65,,Video Editor & Maker AndroVid,Fogosoft Ltd,,100000
2015,12966941,66,,Photo Editor,dev.macgyver,,5000000,66,,Font Candy Photo & Text Editor,Fonts ApS,,100000
2015,214626,67,,Photo Frames,Csmartworld,,5000000,67,,PhotoGrid: Video Collage Maker,"KS Mobile, Inc.",,50000
2015,551339,68,,ElfYourself®,Magic Mirror LLC,,5000000,68,,PicSay - Photo Editor,Shinycore,,50000
2015,209373,69,,Love Collage - Photo Editor,eToolkit Inc,,5000000,69,,The Video Converter,"Float Tech, LLC",,50000
2015,897548,70,,PhotoWonder: Pro Beauty Photo Editor&Collage Maker,DO Global,,5000000,70,,Tadaa SLR,menschmaschine Publishing GmbH,,50000
2015,125955,71,,"Z Camera - Photo Editor, Beauty Selfie, Collage",Video Editor & Video Maker Dev,,5000000,71,,Face & Body Photo editor Lite,Kaeria,,50000
2015,228730,72,,Visage: airbrush photo maker,Linerock Investments LTD,,5000000,72,,黄油相机,北京缪客科技有限公司,,50000
2015,10440494,73,,MP3 Cutter and Ringtone Maker,Lakshmanan Anbalagan,,5000000,73,,BeFunky,BeFunky Inc,,50000
2015,8346131,74,,MiniMovie - Free Video and Slideshow Editor,"Mobile, ASUSTek Computer Inc.",,5000000,74,,Edit Lab Picture Photo Editing,Sotec Consulting S.L,,50000
2015,114579,75,,"NoCrop Edit Picture, Whitagram",Lyrebird Studio,,5000000,75,,ProShot,Rise Up Games,,50000
2015,96143,76,,Photo Editor & Photo Frames: W,App Basic,,5000000,76,,Priime,"Priime, Inc.",,50000
2015,9951928,77,,Split Pic Collage Maker Layout,"Easy Tiger Apps, LLC.",,5000000,77,,VidTrim Pro - Video Editor,Goseet,,50000
2015,58340,78,,Collage Maker - LiveCollage,VIDEO EDITOR PTE. LTD.,,5000000,78,,AfterFocus,"MotionOne Co.,Ltd.",,50000
2015,118332,79,,MIX - Photo Editor & Filters,灏 徐,,5000000,79,,Polarr: Photo Filters & Editor,"Polarr, Inc.",,50000
2015,446696,80,,PhotoFunia,Capsule Digital,,5000000,80,,InstaSize AI Photo Editor＋Crop,Instasize Inc.,,50000
2015,118109,81,,Boomerang from Instagram,Instagram,,5000000,81,,Cinemagraph Pro,Flixel Photos Inc.,,50000
2015,58379,82,,PicPlayPost: Video Editor,Mixcord Inc.,,5000000,82,,EZ Voice,"IK Multimedia US, LLC",,50000
2015,90008,83,,KineMaster-Video Editor&Maker,"KineMaster, Video Editor Experts Group",,5000000,83,,SlideShow Maker Photo to Video,Free Photo Video Editor And Picture Movie Editing Pte. Ltd.,,50000
2015,115140,84,,Color Pop: Photo Changer,Kite Games Studio Ltd,,5000000,84,,DeluxeFX,Pictuts,,50000
2015,871341,85,,Photo Editor,"Maple Media, LLC",,5000000,85,,Color Cap - Add custom text to photos & pics for Instagram,Marcos Escalante,,50000
2015,211769,86,,Flickr,"Flickr, Inc.",,5000000,86,,Logo Maker | Vintage Creator,LOGOFLY LLC,,50000
2015,6096775,87,,Crazy Helium Funny Face Voice,Appkruti Solutions LLP,,5000000,87,,Photo Wonder,"Beijing Duyou Science and Technology Co.,Ltd.",,20000
2015,7969719,88,,Background Eraser,handyCloset Inc.,,5000000,88,,PhotoDirector: AI Photo Editor,Cyberlink Corp,,20000
2015,465279,89,,Video to MP3 Converter,NAINGDroid,,5000000,89,,Lomotif: Social Video Platform,Lomotif Pte Ltd,,20000
2015,205961,90,,PhotoDirector: AI Photo Editor,Cyberlink Corp,,5000000,90,,Snapseed,Google LLC,,20000
2015,170729,91,,"Quik – Free Video Editor for photos, clips, music","GoPro, Inc.",,5000000,91,,FatBooth,PiVi & Co,,20000
2015,10518134,92,,Collage Maker - Grid & Frames,Outdoing Apps,,5000000,92,,"Canva: Design, Photo & Video",Canva,,20000
2015,417923,93,,Video Editor & Maker AndroVid,Fogosoft Ltd,,2000000,93,,"PhotoLayers-Superimpose,Eraser",handyCloset Inc.,,20000
2015,117854,94,,Eye Color Changer - Camera,VysionApps,,2000000,94,,Superimpose+:Background Eraser,KALEIDOSCOPE Inc.,,20000
2015,6063804,95,,VidTrim Pro - Video Editor,Goseet,,2000000,95,,Slideshow Add Music to Photos,"Easy Tiger Apps, LLC.",,20000
2015,708576,96,,Photo Collage Maker PicJointer,"Easy Tiger Apps, LLC.",,2000000,96,,Avatan – Photo Editor,Leonid Ilyaev,,20000
2015,96209,97,,Photo Editor,Video Note LLC,,2000000,97,,Cut Paste Photos Pro Edit Chop,Mesh Soft International LLP,,20000
2015,359449,98,,Photo Wonder,"Beijing Duyou Science and Technology Co.,Ltd.",,2000000,98,,Cymera - Photo Editor Collage,SK Communications,,20000
2015,6087557,99,,Lightroom Photo & Video Editor,Adobe,,2000000,99,,Picsee-Add text on photos,"Xi'an Button Software Technology Co., Ltd.",,20000
2015,182725,100,,Pic Collage Maker PerfectImage,昊 李,,2000000,100,,Lighto- Art photo shape editor,"Xi'an Button Software Technology Co., Ltd.",,20000
2015,10568814,101,,Pomelo Filters,Pixocial Technology Singapore Pte Ltd,,2000000,101,,B612 AI Photo&Video Editor,SNOW Corporation,,20000
2015,729172,102,,SNOW - AI Profile,SNOW Corporation,,2000000,102,,Photo Lab Picture Editor & Art,Linerock Investments LTD,,20000
2015,173615,103,,Pic Stitch - Collage Editor,"Maple Media, LLC",,2000000,103,,Photo Collage Montage Maker,Alan Cushway,,20000
2015,540805,104,,Slow motion video fast&slow mo,Bizo Mobile,,2000000,104,,"PhotoGrid: Video & Pic Collage Maker, Photo Editor",Cheetah Technology Corporation Limited,,20000
2015,300260,105,,Police Suit Photo & Image Edit,App Basic,,2000000,105,,Smart Voice Recorder,SmartMob,,20000
2015,467885,106,,PicSay - Photo Editor,Shinycore,,2000000,106,,Photo Editor Collage: Picsa,Lyrebird Studio,,20000
2015,213711,107,,FxGuru:  Movie FX Director,Picadelic,,2000000,107,,Biometric Passport Photo,Vitalij Schaefer,,20000
2015,6202601,108,,Mixoo:Pic Collage&Grid Maker,"Xi'an Button Software Technology Co., Ltd.",,2000000,108,,ProKnockOut-Cut Paste Photos,"Shenzhen Qianhai Happy Tour Network Technology Co., Ltd.",,20000
2015,6059447,109,,BeFunky,BeFunky Inc,,2000000,109,,Vigo Video,BYTEMOD PTE.Ltd,,20000
2015,6022467,110,,Cute CUT,波 余,,2000000,110,,1967: Retro Filters & Effects,"Maple Media, LLC",,20000
2015,103786,111,,Music Maker JAM: Beatmaker app,Loudly,,2000000,111,,Background Eraser: superimpose,SUNWOONG JANG,,10000
2015,57675,112,,"Adobe Photoshop Mix - Cut-out,",Adobe,,2000000,112,,MovieMaker: Making Videos,Toto Ventures Inc.,,10000
2015,697501,113,,Video Star,Frontier Design Group,,2000000,113,,Stick Nodes: Stickman Animator,ForTheLoss Games,,10000
2015,161407,114,,Face & Body Photo editor Lite,Kaeria,,2000000,114,,Pic Collage Maker PerfectImage,昊 李,,10000
2015,219741,115,,Jane - Collage & Video design,"Shanghai Ruishixinyan Information Technology Co., Ltd",,2000000,115,,WordPack: Word Cloud Generator,Alexey Tataurov,,10000
2015,6087578,116,,FatBooth,PiVi & Co,,2000000,116,,Splice - Video Editor & Maker,Bending Spoons Apps ApS,,10000
2015,282710,117,,AfterFocus,"MotionOne Co.,Ltd.",,2000000,117,,PhotoWonder: Pro Beauty Photo Editor&Collage Maker,DO Global,,10000
2015,1753011,118,,Square Pic Photo Editor-Collage Maker Photo Effect,Photo Editor Perfect Corp.,,2000000,118,,水印相机,Shenzhen Tencent Tianyou Technology Ltd,,10000
2015,439681,119,,Pixgram- video photo slideshow,Swiitt Computing Inc.,,2000000,119,,Photo Editor,dev.macgyver,,10000
2015,484405,120,,PowerDirector - Video Editor,Cyberlink Corp,,2000000,120,,Slow motion video fast&slow mo,Bizo Mobile,,10000
2015,230972,121,,Font Candy Photo & Text Editor,Fonts ApS,,2000000,121,,AudioStretch Lite,Cognosonic Pte Ltd,,10000
2015,8708077,122,,Media Converter,antvplayer,,2000000,122,,LD Photo Editor,Lens Distortions,,10000
2015,6598860,123,,PicMix - Photos in Collages,Inovidea Magna Global,,2000000,123,,Filterloop: Photo Editor,TapLab,,10000
2015,8583386,124,,"Perfect Video Editor, Collage",银峰 汤,,2000000,124,,Pomelo Filters,Pixocial Technology Singapore Pte Ltd,,10000
2015,105658,125,,水印相机,Shenzhen Tencent Tianyou Technology Ltd,,2000000,125,,Infltr - Infinite Filters,Yooshr Ltd,,10000
2015,35345,126,,Blend Collage Free,KDN Soft,,2000000,126,,Artista Impresso,JixiPix Software,,10000
2015,209384,127,,黄油相机,北京缪客科技有限公司,,2000000,127,,Video Merger □ Combine Videos,"Float Tech, LLC",,10000
2015,7973733,128,,Splice - Video Editor & Maker,Bending Spoons Apps ApS,,2000000,128,,Pencil Sketch,Dumpling Sandwich Software Inc.,,10000
2015,14381047,129,,Avatan – Photo Editor,Leonid Ilyaev,,2000000,129,,Pixlr – Photo Editor,Pixlr,,10000
2015,193552,130,,Mega Photo: Real-Time Effects,Falstad.com,,2000000,130,,RNI Films: Photo & RAW Editor,RNI,,10000
2015,547231,131,,EZ Voice,"IK Multimedia US, LLC",,2000000,131,,Scoompa Video: Slideshow Maker,Scoompa,,5000
2015,72590,132,,Lomotif: Social Video Platform,Lomotif Pte Ltd,,1000000,132,,Background Eraser,handyCloset Inc.,,5000
2015,194355,133,,Stop Motion Studio,Cateater,,1000000,133,,Reverse Vid: Video Reverser,Beautiful Video Project Inc.,,5000
2015,467873,134,,Funny Photo Editor,Visu Entertainment,,1000000,134,,FaceArt: Filters for Pictures,Lyrebird Studio,,5000
2015,2356767,135,,ProKnockOut-Cut Paste Photos,"Shenzhen Qianhai Happy Tour Network Technology Co., Ltd.",,1000000,135,,Collage Maker - Mixgram,Lyam Apps,,5000
2015,113154,136,,"Piczoo-Photo Edit,Pic Collage","Xi'an Button Software Technology Co., Ltd.",,1000000,136,,المُصممْ - اكتب على الصور,Husain Khalaf,,5000
2015,959347,137,,Funimate Video & Motion Editor,Pixery Bilgi Teknolojileri,,1000000,137,,"uMake: 3D Modeling CAD, Design",UMake,,5000
2015,222611,138,,Legend - Animate Text in Video & GIF,Stupeflix,,1000000,138,,VOUN,"black box team, LLC",,5000
2015,7366869,139,,"PhotoLayers-Superimpose,Eraser",handyCloset Inc.,,1000000,139,,"Z Camera - Photo Editor, Beauty Selfie, Collage",Video Editor & Video Maker Dev,,5000
2015,87968,140,,TADAA – Camera Focus & Depth,menschmaschine Publishing GmbH,,1000000,140,,Glaze,Gilles DEZEUSTRE,,5000
2015,434455,141,,WavePad Audio Editor,NCH Software,,1000000,141,,InstaMag - Photo Collage Maker,"Fotoable, Inc.",,5000
2015,10652766,142,,Square Sized,Daneco Ltd.,,1000000,142,,Christmas Photo Frames ゜,"Informe Laboratories, Inc.",,5000
2015,710085,143,,Video audio cutter,mytechnosound,,1000000,143,,Blend Collage Free,KDN Soft,,5000
2015,571267,144,,Photo Collage Montage Maker,Alan Cushway,,1000000,144,,Pixgram- video photo slideshow,Swiitt Computing Inc.,,5000
2015,430433,145,,Polarr: Photo Filters & Editor,"Polarr, Inc.",,1000000,145,,"8Bit Photo Lab, Retro Effects",Ilixa,,1
2015,8117320,146,,VideoShow Video Editor & Maker,VIDEOSHOW PTE. LTD.,,1000000,146,,YouCam Perfect: Beauty Camera,PERFECT MOBILE CORP.,,1
2015,111214,147,,Ameba,"CyberAgent, Inc.",,1000000,147,,Tailor - Screenshot Stitching,Foundry 63,,1
2015,605291,148,,Superimpose+:Background Eraser,KALEIDOSCOPE Inc.,,1000000,148,,FotoRus -Camera & Photo Editor,"Fotoable, Inc.",,1
2015,13709,149,,MP3 Cutter and Audio Merger,Clogica,,1000000,149,,Audio Editor Tool: Edit Music,Music Breath,,1
2015,519451,150,,Collage Maker - Mixgram,Lyam Apps,,1000000,150,,PhotoMania - Photo Effects,Trionity,,1
2015,534804,151,,Lighto- Art photo shape editor,"Xi'an Button Software Technology Co., Ltd.",,1000000,151,,No Crop & Square for Instagram,RILEY CILLIAN,,1
2015,6022649,152,,Easy Ringtone Maker for iPhone,Wang Qi,,1000000,152,,Add Background Music To Video,"Easy Tiger Apps, LLC.",,1
2015,182731,153,,Blur Photo & Mosaic,Yu Abe,,1000000,153,,"Piczoo-Photo Edit,Pic Collage","Xi'an Button Software Technology Co., Ltd.",,1
2015,7186659,154,,Photo Editor & Perfect Selfie,Scoompa,,1000000,154,,Add Music To Video Editor,Add Music to Video Maker & Editor LLC,,1
2015,6083978,155,,Vizmato: Video Editor & Maker,Global Delight Technologies Pvt. Ltd,,1000000,155,,BeautyPlus-AI Photo/Video Edit,Pixocial Technology Singapore Pte Ltd,,1
2015,210705,156,,Darkroom: Photo & Video Editor,Bergen Co.,,1000000,156,,MotionPortrait,"MotionPortrait, Inc.",,1
2015,1041684,157,,Thug Life Sticker Pic Editor,Floc Media,,1000000,157,,iCaughtSanta,"Catch A Character, LLC",,1
2015,520766,158,,Picsee-Add text on photos,"Xi'an Button Software Technology Co., Ltd.",,1000000,158,,PIP Camera Pro.,"Fotoable, Inc.",,1
2015,467870,159,,Background Eraser: superimpose,SUNWOONG JANG,,1000000,159,,Photo Collage Maker & Editor,Lyrebird Studio,,1
2015,195346,160,,AirBrush - AI Photo Editor,Pixocial Technology Singapore Pte Ltd,,1000000,160,,Photo Cut Out Editor,丽譞 牛,,1
2015,420169,161,,"Bazaart: Design, Photo & Video",Bazaart Ltd.,,1000000,161,,Acapella Maker - Video Collage,AZ Screen Recorder,,1
2015,127806,162,,Nature Photo Frame - AI Backgr,ClickLab Technology,,1000000,162,,Ripl: Social Media Marketing,"Ripl, Inc.",,1
2015,7989151,163,,Point Blur : blur photo editor,addquick,,1000000,163,,Cartoon Photo Editor,Game Brain,,1
2015,10633315,164,,YouCut - Video Editor & Maker,InShot Inc.,,1000000,164,,SloMo Slow Motion Video Editor,"Loyal Foundry, Inc.",,1
2015,8387043,165,,最美证件照-证件照制作&智能抠图换底色,Hextek,,1000000,165,,Music Speed Changer,"Single Minded Productions, LLC",,1
2015,729192,166,,PICFY- Square Fit Photo Editor,PICFY Technologies Private Limited,,1000000,166,,Camera360-Selfie Editor,灏 徐,,1
2015,10221523,167,,Copy and Paste Photo Collage,Dexati,,1000000,167,,Christmas Photo Frames & Cards,Linerock Investments LTD,,1
2015,195333,168,,المُصممْ - اكتب على الصور,Husain Khalaf,,500000,168,,Image Eraser - Inpaint & heal,丽譞 牛,,1
2015,458419,169,,Adobe Photoshop Fix,Adobe,,500000,169,,Catch Santa Claus in My House,"Dualverse, Inc.",,1
2015,6547007,170,,Face Warp - Plastic Surgery,Hamsoft,,500000,170,,Filterra- Filters for Pictures,IRONTECH LIMITED,,1
2015,1627527,171,,Reduce Photo Size,shoozhoo,,500000,171,,Snapshot Santa - Photo Editor!,Simon Crack,,1
2015,195336,172,,Mematic - The Meme Maker,Theodor Mueller,,500000,172,,Aftercut,丽譞 牛,,1
2015,179278,173,,Photo & Picture Resizer,Farluner Apps & Games,,500000,173,,Catch Santa Claus in my house for Christmas,"Dualverse, Inc.",,1
2015,130429,174,,Spring - Stylish Body Editor,kim taewan,,500000,174,,Clip2Comic: Cartoon Yourself,Digital Masterpieces GmbH,,1
2015,918013,175,,Edit Lab Picture Photo Editing,Sotec Consulting S.L,,500000,175,,VideoJoiner - HD Video Editor,Farooq Ahmad,,1
2015,213704,176,,Cut Paste Photos Pro Edit Chop,Mesh Soft International LLP,,500000,176,,Image Size,Vitalij Schaefer,,1
2015,294199,177,,Video Editor VideoShowLite,VIDEOSHOW Video Editor & Maker & AI Chat Generator,,500000,177,,MediaCrop,Amalgam Apps,,1
2015,940983,178,,Photo Window: Animated Effects,Vacuapps s. r. o.,,500000,178,,Collaging - Pic Collage Maker,Odyssey Apps Ltd.,,1
2015,496959,179,,Square Fit Photo Collage Maker,Photo Editor Perfect Corp.,,500000,179,,Video to MP3 Converter,NAINGDroid,,1
2015,498723,180,,Add Music To Video Editor,Add Music to Video Maker & Editor LLC,,500000,180,,PhotoPad Photo Editor,NCH Software,,1
2015,706937,181,,1967: Retro Filters & Effects,"Maple Media, LLC",,500000,181,,Professional Photo Retouch Ser,Retouchit LLC,,1
2015,224542,182,,Photo Mix + Photo Collage,appreal.net,,500000,182,,HashPhotos,beyondf,,1
2015,707506,183,,九格切图,"Xiamen Meitu Technology Co., Ltd.",,500000,183,,Ringtone Maker and MP3 Editor,JRT Studio Music Players,,1
2015,6308290,184,,Blur Image,Inglesdivino,,500000,184,,PICFY- Square Fit Photo Editor,PICFY Technologies Private Limited,,1
2015,547230,185,,Photo Editor PRO,Lyrebird Studio,,500000,185,,Photo Editor & Perfect Selfie,Scoompa,,1
2015,553909,186,,Make me Old,AppTornado Games,,500000,186,,Photo & Picture Resizer,Farluner Apps & Games,,1
2015,1152498,187,,Cartoon Photo Editor,Game Brain,,500000,187,,Age Editor: Face Aging Effects,"Digital Bananas, LLC",,1
2015,520044,188,,Reverse Vid: Video Reverser,Beautiful Video Project Inc.,,500000,188,,PicMix - Photos in Collages,Inovidea Magna Global,,1
2015,8030835,189,,Nature photo frames & editor,APPDEVELOPER202,,500000,189,,Sketch Master - Cartoon Photo,Dumpling Sandwich Software Inc.,,1
2015,6096037,190,,Color Cap - Add custom text to photos & pics for Instagram,Marcos Escalante,,500000,190,,Photo Collage Editor,Zentertain,,1
2015,477781,191,,Vont - Text on Videos,youthhr,,500000,191,,Video Compress,Mel studio apps,,1
2015,173611,192,,Photo Video Editor,Video Note LLC,,500000,192,,Photo Collage Maker & Creator,Alan Cushway,,1
2015,683073,193,,Retouch Me: Body & Face Editor,Good Retouch LP,,500000,193,,Photo Mix + Photo Collage,appreal.net,,1
2015,173608,194,,Filterloop: Photo Editor,TapLab,,500000,194,,Magic Eraser Background Editor,Alan Cushway,,1
2015,1343798,195,,TouchNote Custom Cards & Gifts,TouchNote Ltd,,500000,195,,Muse - Music & Video Editor,John Galliano,,1
2015,861050,196,,Beauty Camera Plus Selfie Edit,Multi Tech Apps,,500000,196,,Easy Ringtone Maker for iPhone,Wang Qi,,1
2015,691341,197,,Videoshop - Video Editor,Jajijujejo Inc.,,500000,197,,TNPSC TAMIL GROUP 4 + VAO 2023,Nithra,,1
2015,173610,198,,Photo Editor,Coocent,,500000,198,,Blur Photo Effect Background,Alan Cushway,,1
2015,227408,199,,Slideshow Add Music to Photos,"Easy Tiger Apps, LLC.",,500000,199,,Ultralight: Photo Video Editor,Uova Oy,,1
2015,132781,200,,Photo Frames,Visu Entertainment,,500000,200,,CleanPics,Clean Pics LLC,,1
2015,120214,201,,Logo Maker | Design Creator.,Logo Maker LLC,,500000,201,,8bit Painter,OneTap Japan,,1
2015,6047142,202,,Priime,"Priime, Inc.",,200000,202,,Video Editor@,IAPPTECHNOLOGIES LLP,,1
2015,752030,203,,Collage Maker,ClickLab Technology,,200000,203,,intoLive - Live Wallpapers,"ImgBase, Inc.",,1
