Year,App ID,Top Free Number,Top Free Different,Top Free Name,Top Free Publisher,Top Free Tags,Top Free Downloads,Top Grossing Number,Top Grossing Different,Top Grossing Name,Top Grossing Publisher,Top Grossing Tags,Top Grossing Revenue
2022,9109967,434,,Quotes Creator with Images,O Cara das Frases,,1000000,434,-57,Artisan: Cartoon Photo Editor,Lyrebird Studio,,50000
2022,5260751,435,-132,XEFX-3D Camera &Photo Animator,cerdillac,,1000000,435,-62,Book Cover Maker by Desygne‪r,Desygner Pty Ltd,,50000
2022,195346,436,-230,Instasquare Photo Editor: Neon,Lyrebird Studio,,1000000,436,31,Photo Cut Out Editor,丽譞 牛,,50000
2022,9154757,437,275,"Beauty Camera X, Selfie Camera",Beauty Apps Studio,,1000000,437,50,最美证件照-证件照制作&证件照换底色&证件照相机&一寸照,"Shanghai Yongchu Network Technology Co., Ltd",,50000
2022,679242,438,-150,Lovi - Video Editor & Maker,Nucleus Lab,,1000000,438,18,Collage Maker Photo Editor App,Pic Collage Maker & Photo Editor,,50000
2022,7703701,439,76,Hotune Body Editor & Face Slim,cerdillac,,1000000,439,44,"Invitation card Maker, Design",Splendid App Maker,,50000
2022,4702880,440,,Time Cut: Smooth Slow Motion,立亚 林,,1000000,440,-1,Minimoog Model D Synthesizer,Moog Music Inc.,,50000
2022,8571682,441,-81,Photo Frame  - Collage Maker,Photo Editor Perfect Corp.,,1000000,441,-107,Insta Story Collage Maker for ,Mivo studio,,50000
2022,13136620,442,164,YouCam Video: Makeup Editor,PERFECT MOBILE CORP.,,1000000,442,-86,Refine: Video & Photo Editor,FireArc Technologies Ltd.,,50000
2022,6792503,443,,剪同款-盐甜女孩的修图剪片法宝！,"Chongqing Yeyuegua Technology Co., Ltd",,1000000,443,,快影-创作有趣的视频,"Beijing Kwai Technology Co., Ltd.",,50000
2022,7390809,444,500,"Ringtone Maker, MP3 Cutter",Easy To Use (OnMobi),,1000000,444,32,Chic - Stylish Camera,"Xiamen Meitu Technology Co., Ltd.",,50000
2022,202550,445,,Square Pic Photo Editor-Collage Maker Photo Effect,Photo Editor Perfect Corp.,,1000000,445,-34,iMovie,Apple,,50000
2022,5090877,446,514,Photo Retouch- Object Removal,"Shenzhen Leyuan Shentu Technology Co., Ltd",,1000000,446,16,Pixel Studio: pixel art editor,Hippo,,50000
2022,10569003,447,351,BlackHole,fawazapp,,1000000,447,-361,VOCHI Video Effects Editor,Pinterest,,50000
2022,6047142,448,-132,12Camera Selfie Beauty Camera,"Selfie Beauty Photo Editor: Beauty Camera, Filters",,1000000,448,-89,Video Editor@,IAPPTECHNOLOGIES LLP,,50000
2022,6096037,449,-91,FilmBox by Photomyne,Photomyne LTD,,1000000,449,-57,Photo Collage Editor,Zentertain,,50000
2022,9957940,450,-70,MediaCrop,Amalgam Apps,,1000000,450,,Video to MP3 Convert & Cutter,Video to MP3 Converter & MP3 Cutter,,50000
2022,113154,451,210,PrettyUp- AI Body Editor Video,立亚 林,,1000000,451,33,المُصممْ - اكتب على الصور,Husain Khalaf,,50000
2022,7940632,452,-4,Photo Studiо,KVADGroup App Studio,,1000000,452,115,Vieka: Music Video Editor&Edit,FEDERATION NETWORK LIMITED,,50000
2022,228060,453,-104,Photo Video Maker with Music,Multi Tech Apps,,1000000,453,-118,Videorama Text & Video Editor,Life Fertility Tracker IVS,,50000
2022,9571857,454,247,Man Bike Rider Photo Editor,SoftSquare InfoSoft,,1000000,454,,创作猫,广旭 刘,,50000
2022,618420,455,221,Phinsh Photo Collage Maker,Unique Pixel Studio,,1000000,455,-50,Video Editor VideoShowLite,VIDEOSHOW Video Editor & Maker & AI Chat Generator,,50000
2022,5314369,456,-247,Police Photo Suit for Mens and Womens Photo Editor,Photo Frame & Photo Editor Apps,,1000000,456,-92,Video Editor with Music Filmix,Pro Video Editor & Music Video Maker Photo Collage,,50000
2022,7592720,457,-200,Photo Editor Effect- Pic Layer,riki,,1000000,457,4,Mivo: Face swap video bride,Mivo studio,,50000
2022,7017076,458,-54,Scoompa Video: Slideshow Maker,Scoompa,,1000000,458,-48,Video Maker-movie maker&Editor,"Changsha Fugui Bamboo Network Technology Co., Ltd.",,50000
2022,6092651,459,,Video Maker - Slideshow Maker,HD Video Maker - Video Editor,,1000000,459,-53,Blur photo - background editor,Peml Art FZC LLC,,50000
2022,10381885,460,139,Adobe Illustrator: Graphic Art,Adobe,,1000000,460,,"AI Enhancer, AI Photo Enhancer",AI Photo Team,,50000
2022,9280714,461,-92,Love Photo Effect Video Maker,array infotech,,1000000,461,268,Shaped - Logo Design Maker,"Clime Weather Service, LLC",,50000
2022,6188447,462,186,Image Size,Vitalij Schaefer,,1000000,462,-173,PicsHub-AI Art & Photo Edit,Onekitty International Limited,,50000
2022,6236772,463,-72,Vlog Star - video editor,cerdillac,,1000000,463,198,Smoke Name Art Maker,ZipoApps,,50000
2022,8177669,464,-247,Background Eraser Photo Editor,Photo Creation App,,1000000,464,-126,"YuFace: Makeup Cam, Face App","Welly Corp Co., LTD",,50000
2022,8091887,465,-69,PiP camera collage maker,KVADGroup App Studio,,1000000,465,-7,Grid Post - Grids Photo Crop,INFOSTRING TECHNOLABS PRIVATE LIMITED,,50000
2022,7905061,466,-109,Video maker,lsla - photo & video maker,,1000000,466,11,"Intro Maker, Outro Maker",Video Marketing Apps,,50000
2022,10648619,467,-146,Video Editor ·,Luni,,1000000,467,,Lotus - AI Photo Face Animator,CLOUD HIGH INVESTMENT LIMITED,,50000
2022,8163108,468,293,Loop Maker Pro: Dj Beat Maker,Gismart,,1000000,468,-26,Motion Ninja Video Editor,accordion,,50000
2022,10683627,469,-83,PICNIC - Weather Genie Photo,ESTsoft Corp.,,1000000,469,,Vids AI - Reels Video Editor,Viral Vision Ltd.,,50000
2022,7037337,470,-284,StoryLab - Story Maker,cerdillac,,1000000,470,-287,Photo Editor゜,"Easy Tiger Apps, LLC.",,50000
2022,7633521,471,-66,Retrica-Original Filter Camera,"Retrica, Inc.",,1000000,471,494,Grid: Post Maker for Instagram,Dima Komar,,50000
2022,205961,472,,Gallery manage photos & albums,T21 Games,,1000000,472,-2,Snapseed,Google LLC,,50000
2022,553909,473,17,Smart Voice Recorder,SmartMob,,1000000,473,65,Photo & Picture Resizer,Farluner Apps & Games,,50000
2022,10526890,474,-155,Videoshop - Video Editor,Jajijujejo Inc.,,1000000,474,,Face Swap Video by Deep Fake,DeepFaker LLC,,50000
2022,9792480,475,-119,Vont - Text on Videos,youthhr,,1000000,475,,Perfect365 Video Makeup Editor,"Perfect365, Inc.",,50000
2022,6066306,476,-340,AI Art Photo Editor: Selfie AI,Mivo studio,,1000000,476,-139,Blur Photo Editor Background,Connects Ltd,,50000
2022,6598860,477,161,Photo Editor-SquarePic Collage,Square Photo&Photo Editor Studio,,1000000,477,-221,Filterloop: Photo Editor,TapLab,,50000
2022,6098838,478,143,Photo Sketch Maker,Aero Tools,,1000000,478,-274,Crop Video: Cropper and Cutter,"Easy Tiger Apps, LLC.",,50000
2022,4045802,479,27,"Piczoo-Photo Edit,Pic Collage","Xi'an Button Software Technology Co., Ltd.",,1000000,479,-49,XEFX-3D Camera &Photo Animator,cerdillac,,50000
2022,5203002,480,-189,Poster Maker & flyer maker app,Splendid App Maker,,1000000,480,114,Video Compressor Panda Resizer,Farluner Apps & Games,,50000
2022,94015,481,-34,Text Photo - Photo Text Editor,AVN Software Inc,,1000000,481,-84,Crazy Helium Funny Face Voice,Appkruti Solutions LLP,,50000
2022,10569002,482,37,PRISM Live Studio: Games & IRL,NAVER WEBTOON Ltd.,,1000000,482,-92,"UniStory -Story Maker, Collage",InShot Inc.,,50000
2022,4527,483,-10,Ultimate Photo Blender / Mixer,Iris Studios and Services,,1000000,483,77,طرب الفيديو,Saed Hamdan,,50000
2022,10629857,484,38,Audio Editor - Music Mixer,妍 岳,,1000000,484,,Pixel Max - AI Photo Enhancer,"Imprexxive Digital, LLC",,50000
2022,9377801,485,-10,Loopsie: AI Art Generator,KRNL SRL,,1000000,485,376,"Remove Watermark, Easy Retouch",ChatGenies & AskGPT AI Assistant RPG Technologies,,50000
2022,9619513,486,,Boomerit Boomerang Video Maker,CUBETIX,,1000000,486,32,Graphionica: insta story maker,Graphionica App,,50000
2022,10146866,487,-146,Voice Changer - Voice Editor,SoulApps Studio,,1000000,487,,Passport/VISA Photo Creator,BigQ Group,,50000
2022,9143196,488,,Hairfit - k-pop hairstyle,Virtualive,,1000000,488,206,Ringtone Maker: Music Cutter,Dairy App & Notes & Audio Editor & Voice Recorder,,50000
2022,8374016,489,-48,Thug Life Sticker Pic Editor,Floc Media,,1000000,489,-74,Presets for Lightroom & Filter,Inspiring Apps LLC,,50000
2022,7120011,490,12,"Grids: Giant Square, Templates",TapLab,,1000000,490,-52,Polarr 24FPS,"Polarr, Inc.",,50000
2022,9962918,491,-243,Name Photo On Birthday Cake,Vedmetè App & Video Downloader,,1000000,491,,Dream AI Art: Generated Avatar,SMART WIDGET LABS COMPANY LIMITED,,50000
2022,9449546,492,-203,DripArt: Photo Editor App,Lyrebird Studio,,1000000,492,437,AI Photo Enhancer - BlurBuster,KallosSoft,,50000
2022,9503160,493,171,Family photo editor & frames,Smart Photo Editor,,1000000,493,367,Perface-Upload&Face Swap,海口云中科技发展有限公司,,50000
2022,774806,494,47,"Video Eraser, Remove Watermark",Dong Qi Technology,,1000000,494,-72,Griddy: Split Photo Grids Post,keang david,,50000
2022,238089,495,-199,Romantic Love Photo Frames,Visu Entertainment,,1000000,495,-141,FxGuru:  Movie FX Director,Picadelic,,50000
2022,8877381,496,14,"Mirror: Emoji maker, Stickers",Mirror AI,,1000000,496,16,Video Get Pro - Private Editor,Nguyen Anh,,50000
2022,8552483,497,120,"AI Photo Editor, BG Remover",Apero Technologies Group - TrustedApp,,1000000,497,12,NeonArt Photo Editor & Effects,Lyrebird Studio,,50000
2022,8022185,498,-126,VideoToLive - Live Photo Maker,Thomas Yoon,,1000000,498,-180,Sticker Maker & Funny Emoji Up,Mithril Mobile,,50000
2022,8143753,499,164,Bokeh Cut Cut - Photo Editor,Bokeh photoeditor,,1000000,499,4,Boomerang Video Maker,Boomerang Maker,,50000
2022,8583386,500,,Advance Face Makeup Editor,tomamonzon12,,1000000,500,-96,Pomelo Filters,Pixocial Technology Singapore Pte Ltd,,50000
2022,7181030,501,207,Nature photo frames & editor,APPDEVELOPER202,,1000000,501,496,Photo Eraser - Remove Objects,Toscana Lavori srl,,50000
2022,5760081,502,-121,Video Editor - Star Maker,Seanapps Create,,1000000,502,-74,Glitch Art Studio: Cam Effects,NET Sigma,,50000
2022,3453162,503,-278,Video Downloader : Downloader,Music Online Studios Inc.,,1000000,503,16,"GIF Maker, GIF Editor",GIF Maker & GIF Editor & Video Maker,,50000
2022,386842,504,-75,Birthday Video Maker Song Name,Birthday Video Maker with Song Name Birthday Cards,,1000000,504,-130,Mega Photo: Real-Time Effects,Falstad.com,,50000
2022,58379,505,,Linearity Curve Graphic Design,Linearity GmbH,,1000000,505,-31,EZ Voice,"IK Multimedia US, LLC",,50000
2022,9995814,506,92,Photo Collage Editor & Maker,ImageArt Inc.,,1000000,506,,Blur Background Photo Editor,Appic Stars LLC,,50000
2022,5204717,507,51,Vlog video editor maker: VlogU,MyMovie Inc.,,1000000,507,-12,Vlog Star - video editor,cerdillac,,50000
2022,103785,508,-28,دمج الصور والاغانى وصنع فيديو ,hafidabano,,1000000,508,43,Blur Photo Background,SUNWOONG JANG,,50000
2022,8535403,509,,Beauty Camera & Photo Editor,AVA Studio,,1000000,509,-186,Beat.ly Music Video Maker,鼎 王,,50000
2022,7134786,510,-27,"Kids Photo Editor, Boys Editor",Appwallet Technologies,,1000000,510,-22,PhotoCut Remove Bg AI Cut Out,Imagix AI Private Limited,,50000
2022,10836793,511,238,Birthday Photo Frame Maker,ZipoApps,,1000000,511,,Fantasy-Photo Editor&Animator,Hexiqon,,50000
2022,6998524,512,-329,Facetune Video by Lightricks,Lightricks Ltd.,,1000000,512,-61,Moving Pictures & 3D pictures,Imagix AI Private Limited,,50000
2022,6332961,513,-29,Video Merge : Easy Video Merge,photoshop mobile apps,,1000000,513,-44,Marketing Slideshow Maker,Digital Marketing Tools,,50000
2022,97576,514,-176,Heart Photo Effect Video Maker,maXmediA,,1000000,514,296,Blur Photo & Mosaic,Yu Abe,,50000
2022,6227136,515,348,LD Photo Editor,Lens Distortions,,1000000,515,96,Passport Photo Maker-ID Photo,润娟 邹,,50000
2022,7452171,516,,Video Editor & Movie Maker,TikiP Studio,,1000000,516,318,Video Editor Music Video Maker,"Video Editor Photo Editor, Video Maker With Music",,50000
2022,7437081,517,,画世界,"Shijiazhuang huanci Network Technology Co., Ltd",,1000000,517,-119,Salad Video -Video Editor,灏 徐,,50000
2022,7522094,518,,Boomerang Video Maker Loop,SocialKit LTD,,1000000,518,30,InstaSave - Repost Reels Story,Ahmet Yalcinkaya,,50000
2022,114579,519,19,Village Photo Frames,App Bench,,1000000,519,-72,ProShot,Rise Up Games,,50000
2022,9072412,520,449,BoomArt: FaceChanger&Cartoon,Boom Studio,,1000000,520,-15,ArtistA: Cartoon Photo Editor,Lyrebird Studio,,50000
2022,4925905,521,-279,Song Video Maker - Photo Video,GrowUp Infotech,,1000000,521,-6,Add Music To Video & Editor,Kite Games Studio Ltd,,50000
2022,694648,522,-123,Sweet Beauty Cam: for selfie,Mivo studio,,1000000,522,42,Passport Photo Maker – VISA/ID,Andronepal,,50000
2022,6816695,523,-117,Video Speed Changer : SlowMo F,photoshop mobile apps,,1000000,523,-32,Colorize Images,Colorize Images,,50000
2022,8749768,524,23,PicsIn - Smart Photo Editor,WangSU Store,,1000000,524,206,Boomerit Boomerang Video Maker,CUBETIX,,50000
2022,7294058,525,-63,Remove & Add Watermark,WATER INC,,1000000,525,102,Bingo Cam - Cartoon Photo,"Vela Technology Co.,Limited",,50000
2022,8318483,526,-136,"Intro Maker, Outro Maker",Video Marketing Apps,,1000000,526,181,EasyCut - Video Editor & Maker,Great Talent Video Inc. Video Editor App,,50000
2022,118819,527,17,Pic Collage Maker PerfectImage,昊 李,,1000000,527,22,DeepArtEffects AI Photo Editor,Deep Art AI GmbH,,50000
2022,4969135,528,,Logo Maker - Logo Creator app,Apero Technologies Group - TrustedApp,,1000000,528,-12,Sculptura 3D,Audulus LLC,,50000
2022,8429730,529,159,Beauty Smooth camera - Selfie ,Psii,,1000000,529,56,GoCut - Effect Video Editor,Like GoCut,,50000
2022,10518097,530,154,L.O.L. Surprise! Movie Maker,Outright Games Limited,,1000000,530,-51,飞推(趣推) - 创意视频制作神器,TAK BO TRADING DEVELOP LIMITED,,50000
2022,4063996,531,208,Clay – Story Templates Frames,Plexagon s.r.l.,,1000000,531,84,简影-Video Editor,北京简影优视科技有限公司,,50000
2022,14054029,532,,Apowersoft: Background Eraser,"Wangxu Technology Co., Ltd",,1000000,532,-364,IllisiumArt,Ravage Vladislav,,50000
2022,8139580,533,365,Pixel Studio: pixel art editor,Hippo,,1000000,533,-78,Background Eraser .,Wang Yuyang,,50000
2022,5649967,534,133,Hiface - Face Shape Detector,Hiface,,1000000,534,-5,"Poster Maker, Flyer Maker",stylish app world,,50000
2022,7372069,535,,Birthday Video Maker,ITHotShots,,1000000,535,-36,ZAO - 超好玩！,"Beijing Momo Technology Co., Ltd.",,50000
2022,8694588,536,-125,Slideshow Maker (SlidePlus),QuVideo Inc. Video Editor & Video Maker App,,1000000,536,-194,Slow Motion Video Editor SLOMO,App Dynatics LLC,,50000
2022,7397824,537,-19,Book Cover Maker by Desygne‪r,Desygner Pty Ltd,,1000000,537,-244,Dazzle - Insta stories editor,Conceptiv Apps LLC,,50000
2022,8390988,538,352,Face Beauty Makeup Camera-Self,Daily Aims,,1000000,538,96,Add Text: poster maker. Flyer,Cosmoshark,,50000
2022,9212371,539,,Birthday Video Maker,FlyingAppStudio,,1000000,539,,AVU-AMV Velomingo Video Editor,"Hangzhou YOUPIN Technology Co., Ltd",,50000
2022,697501,540,,ArtX | Video Story Maker,Photo Point,,1000000,540,-162,Stick Nodes: Stickman Animator,ForTheLoss Games,,50000
2022,7333357,541,-15,ClipDrop - Cleanup Pictures,Init ML,,1000000,541,-188,Intro Maker: Make Outro for YT,Vidthug Pte Ltd,,50000
2022,8409339,542,,Hair Style Photo Editor,Bhima Apps,,1000000,542,16,SplitHit: Vocal Remover,Sphereo,,50000
2022,10923300,543,36,Photo Collage Montage Maker,Alan Cushway,,1000000,543,-125,Photo Editor,"Maple Media, LLC",,50000
2022,7210134,544,287,"Slow motion - slow mo, fast mo",Watermark Remover & Slow motion & SlowMo,,1000000,544,-12,LikeAPPro,LikeAPPro,,50000
2022,7621865,545,-379,Blur photo - background editor,Peml Art FZC LLC,,1000000,545,189,AI Enlarger: for Photo & Anime,通 张,,50000
2022,9734853,546,,Love Photo Effect Video Maker,Zeron Loft Studio,,1000000,546,,PicMa - AI Photo Enhancer,MagicTiger Photo&Video Enhancing,,50000
2022,6097048,547,139,Graphionica: insta story maker,Graphionica App,,1000000,547,-138,Pins-Artistic Effects Camera,微咔世纪,,20000
2022,10553247,548,5,StoryCut - Video Editor &Maker,"Wenzhou XunChi Digital Technology Co., Ltd.",,1000000,548,,Spool - Music Video Maker,Pixite Inc.,,20000
2022,727547,549,-20,Vertical Gallery,Mobsnake,,1000000,549,31,April - Layouts Photo Collage,灏 徐,,20000
2022,6109413,550,-89,Mobile Projector Photo Maker,Unlock studio,,1000000,550,-53,Mostory-  Story Maker & Editor,cerdillac,,20000
2022,11019029,551,230,Photo On Photo Editor,Sociu,,1000000,551,63,Thumbnail Maker - Channel art,CA Publishing,,20000
2022,10975326,552,155,Blur Photo Effect Background,Alan Cushway,,1000000,552,,Velomingo: Velocity Edit Maker,Pixery Bilgi Teknolojileri,,20000
2022,9172709,553,-41,Watercolor Logo Maker: Creator,"Tap Flat Apps, LLC",,1000000,553,,Liit - Photo & Video Editor,微微 陈,,20000
2022,9883577,554,99,Paintwork-Sketch Drawing Pad,伟典 苏,,1000000,554,,100ZG-Format Conversion,"NetPocket Co., Ltd.",,20000
2022,10185832,555,,Music Video Editor - inMelo,Music Video Editor with Effects & Slideshow,,1000000,555,,SnapEdit - Remove Objects AI,SilverAI Joint Stock Company,,20000
2022,217902,556,87,Profile Picture Border Frame,ZipoApps,,1000000,556,399,Ameba,"CyberAgent, Inc.",,20000
2022,5248071,557,66,"Invitation card Maker, Design",Splendid App Maker,,1000000,557,6,Add Watermark -Batch Process,Logo Maker LLC,,20000
2022,7477511,558,166,Name Art - Text Creator,One Stop Solutions RK,,1000000,558,-112,Ovicut - Smart Video Editor,VMix Video Editor with Music and Effects Ltd.,,20000
2022,7671741,559,152,TweenCraft cartoon video maker,Tweencraft,,1000000,559,92,Movie Editing - Pro Video Edit,Slider Video Maxmovie,,20000
2022,8078556,560,,LoopYa: Face Aging Editor,Funny Face Group,,1000000,560,180,Background Eraser・Photo Editor,ZipoApps,,20000
2022,7989369,561,168,VivuVideo-Audio Spectrum Maker,Desa Mobi,,1000000,561,-36,Song Maker - Music Mixer,Brain Vault,,20000
2022,6448706,562,,Compose Music Video Editor,Pixery Bilgi Teknolojileri,,1000000,562,365,画世界,"Shijiazhuang huanci Network Technology Co., Ltd",,20000
2022,9089838,563,-81,Cartoon Photo Editor,Game Brain,,1000000,563,158,Animated Stickers Maker for Wh,runnableapps,,20000
2022,12966773,564,388,Pic Collage Maker - InCollage,InShot Inc.,,1000000,564,-188,"Intro Music Video, Movie Maker",Khue Nguyen,,20000
2022,9809238,565,,Heva Cartoon Creator,NICHOLAS HAROLD MILLWARD,,1000000,565,,Video Editor - Vidma Editor,Vidma Video Studio,,20000
2022,118109,566,,Liit - Photo & Video Editor,微微 陈,,1000000,566,-126,Cinemagraph Pro,Flixel Photos Inc.,,20000
2022,9602562,567,,Object Remover by Touch Up,"Face & Body Tune Photo Editor, Societatea cu Raspundere Limitata",,1000000,567,,Time Cut: Smooth Slow Motion,立亚 林,,20000
2022,11018858,568,-137,Filmmaker Pro - Video Editor,Tinkerworks Apps,,1000000,568,-108,Invitation maker & Card Design,CA Publishing,,20000
2022,5190303,569,-131,Easy Video Cutter,NAINGDroid,,1000000,569,-46,Video Editor with Song Clipvue,Pro Video Editor & Music Video Maker Photo Collage,,20000
2022,7659372,570,,Mivo - Music Video Maker,WISE OWL PTE. LTD.,,1000000,570,14,AudioLab Audio Editor Recorder,HitroLab - Mp3 Audio Editor & Voice Recorder Dev,,20000
2022,10955893,571,-267,Name Photo On Birthday Cake,Image Crop n Wallpaper Changer,,1000000,571,,时间水印相机-真实记录生活时间工作内容,婷婷 吴,,20000
2022,6574188,572,131,Add Text: poster maker. Flyer,Cosmoshark,,1000000,572,-171,Funny Video Maker - JokeFaces,Mimoza Bilgi Teknolojileri Limited Sirketi,,20000
2022,9812225,573,149,Audio Video Noise Reducer,Inverse.AI,,1000000,573,,Story Maker for Instagram: STR,Onelight Apps CY Ltd,,20000
2022,9912585,574,,パシャット　写真プリント・印刷・現像・証明写真,Fukuta DP Inc.,,1000000,574,,Zlumley,Katlyn Crabtree,,20000
2022,8119874,575,259,稿定设计-用模板轻松作图拼图,"Gaoding (Xiamen) Technology Co., Ltd.",,1000000,575,74,Photo Editor & Photo Effects,InShot Inc.,,20000
2022,6986482,576,26,Compress Video Size Compressor,Inverse.AI,,1000000,576,93,Story Maker & Reels - MoArt,Xinh Art Studio,,20000
2022,9321082,577,303,Polarr 24FPS,"Polarr, Inc.",,1000000,577,-269,Vakie-Music Video Maker,"Hangzhou Yingqu Internet Technology Co.,Ltd.",,20000
2022,8768561,578,-217,Video Editor & Maker- My Movie,MyMovie Inc.,,1000000,578,89,Mivi :Music & AI Video Maker,Music Video Studio,,20000
2022,182725,579,,"Kriadl: Flyer & Logo, Design",Image Crop n Wallpaper Changer,,1000000,579,-14,Lighto- Art photo shape editor,"Xi'an Button Software Technology Co., Ltd.",,20000
2022,9182527,580,,Video Filters Photo Editor・TON,Onelight Apps CY Ltd,,1000000,580,68,日杂相机,"Guangzhou Mengdong Information Technology Co., Ltd.",,20000
2022,7318431,581,-233,Photolift - Face & Body Editor,Mimoza Bilgi Teknolojileri Limited Sirketi,,1000000,581,-19,Video Editor & Maker AndroVid,Fogosoft Ltd,,20000
2022,9457513,582,-61,Wild Animal Photo Frames,App Bites,,1000000,582,,Video Eraser-Retouch Removal,"Shenzhen Leyuan ShentuTechnology Co.,Ltd",,20000
2022,6547008,583,-116,Video Collage Maker:Mix Videos,Momentic Apps,,1000000,583,-238,FLMX - Video Editor,UTILITY APPS LP,,20000
2022,6269229,584,367,Tailor-auto screenshot stitch,Dehui Chengzhen,,1000000,584,19,Hotune Body Editor & Face Slim,cerdillac,,20000
2022,10221523,585,338,Biometric Passport Photo,Vitalij Schaefer,,1000000,585,-17,Christmas Photo Frames & Cards,Linerock Investments LTD,,20000
2022,7715658,586,,Image Converter - PDF/JPG/PNG,Battery Stats Saver,,1000000,586,109,Logo Maker : Graphic Design,Mobi App & Thumbnail Maker Inc,,20000
2022,7620623,587,,Birthday video maker with song,H20 Studio,,1000000,587,-79,Photo Editor - Beauty Effect,Macland Group,,20000
2022,224542,588,-6,No Crop & Square for Instagram,RILEY CILLIAN,,1000000,588,-86,HashPhotos,beyondf,,20000
2022,8167218,589,-418,Wonder Video Editor Crop Video,Video Editor & Video Maker Dev,,1000000,589,7,AI Art Generator & AI Avatar,VIDEOSHOW Video Editor & Maker & AI Chat Generator,,20000
2022,4954691,590,,Desygner: Graphic Design Maker,Desygner Pty Ltd,,1000000,590,78,Invitation Maker,Desygner Pty Ltd,,20000
2022,3423531,591,,Slow Motion & Speed Video,WorkerBee App,,1000000,591,-35,Varnist - Photo Art Effects,Varnist,,20000
2022,6777507,592,,PicWish: AI Photo Editor,"Wangxu Technology Co., Ltd",,1000000,592,-205,Background Eraser & Editor,Blue Bike LLC,,20000
2022,7474310,593,-334,Remove Background: BG Changer,Luna Media,,1000000,593,145,Text Art: Quote & Poster Maker,Image Crop n Wallpaper Changer,,20000
2022,7622399,594,192,Video Editor No Watermark Make,"Video Screen Recorder, Voice Audio Editor, Cut MP3",,1000000,594,-228,PicPlus®️ - Photo Editor Pro,Enerjoy,,20000
2022,8467399,595,-119,Square Fit Photo Collage Maker,Photo Editor Perfect Corp.,,1000000,595,295,Beautify: Beauty makeup editor,Advance Appsol Techonologies,,20000
2022,7444558,596,306,PortraitAI - Classic Portrait,PortraitAI,,1000000,596,-107,Story Editor – Story Maker,cerdillac,,20000
2022,4867268,597,4,المصمم العربي - كتابة ع الصور,A-DEVS,,1000000,597,-104,Music Video Editor - VCUT Pro,VIDEOSHOW Video Editor & Maker & AI Chat Generator,,20000
2022,10637758,598,11,Video audio cutter,mytechnosound,,1000000,598,,Shock Filters,M Junior,,20000
2022,9580127,599,-47,Photo Retouch : Remove Objects,俊杰 阮,,1000000,599,-54,L.O.L. Surprise! Movie Maker,Outright Games Limited,,20000
2022,7495009,600,-22,Muvid - Music Video Maker,FIREMOBILE,,1000000,600,12,Collage Maker - Photo Editor,Collage Maker&Photo Collage Corp,,20000
2022,467891,601,27,Calligraphy,Devkrushna Infotech Private Limited,,1000000,601,-103,PicsApp Photo Editor & Collage,Lyrebird Studio,,20000
2022,7007388,602,-149,"Slideshow Maker, Video Editor","Welly Corp Co., LTD",,1000000,602,62,Highlight Cover Maker for IG,TarrySoft,,20000
2022,4044919,603,210,"Enhance Photo Quality, Upscale",Csmartworld,,1000000,603,-75,Fotogenic : Face & Body Editor,Hde7 Software,,20000
2022,195345,604,-149,"Men HairStyle, Suits, Mustache",Mobi Softech,,1000000,604,66,"Face Story -Morph, Change Face",丽譞 牛,,20000
2022,7973733,605,-241,MadLipz,Eigenuity Inc.,,1000000,605,34,Pencil Sketch,Dumpling Sandwich Software Inc.,,20000
2022,5947844,606,,Vide - Video Status Maker,Max App Solution,,1000000,606,74,NEON GIF+TEXT Video Effects,Platfarm Inc.,,20000
2022,206341,607,,"Watermark remover, Logo eraser",Watermark Remover & Slow motion & SlowMo,,1000000,607,-148,Vizmato: Video Editor & Maker,Global Delight Technologies Pvt. Ltd,,20000
2022,120214,608,41,Dual Photo Mixer - Photo joint,MVLTR Apps,,1000000,608,0,8bit Painter,OneTap Japan,,20000
2022,9041719,609,,Insta360,"Shenzhen Arashi Vision Co., Ltd.",,1000000,609,385,Festival Poster Maker & Video,Corporate Enterprise,,20000
2022,8661489,610,,Video & Image compressor size,appsRock,,1000000,610,-191,Magic Video Maker - director,APPS INNOVA,,20000
2022,467870,611,,Clips,Apple,,1000000,611,-5,Photo Collage Maker & Editor,Lyrebird Studio,,20000
2022,6022467,612,226,Collage Maker - Photo Editor,Collage Maker&Photo Collage Corp,,1000000,612,-132,1967: Retro Filters & Effects,"Maple Media, LLC",,20000
2022,4622583,613,346,Tempi Art-Cartoon&AnimatePhoto,广州量子互娱科技有限公司,,1000000,613,-74,ID Passport VISA Photo Maker,Yarsa Games,,20000
2022,6673778,614,-48,Photo Collage Editor,Video Mobile VM,,1000000,614,-26,Posters: graphic design maker,KVADGroup App Studio,,20000
2022,8523185,615,-298,Efectum – Video Editor & Maker,Craigpark Limited,,1000000,615,-63,PicsKit Photo Editor & Design,accordion,,20000
2022,8387043,616,-1,WavePad Audio Editor,NCH Software,,1000000,616,21,Music Speed Changer,"Single Minded Productions, LLC",,20000
2022,10282716,617,,Logo Maker: Logo Designer,splaish,,1000000,617,,FitPix - Collage Maker,eToolkit Inc,,20000
