Year,App ID,Top Free Number,Top Free Different,Top Free Name,Top Free Publisher,Top Free Tags,Top Free Downloads,Top Grossing Number,Top Grossing Different,Top Grossing Name,Top Grossing Publisher,Top Grossing Tags,Top Grossing Revenue
2020,467886,766,-339,Music video maker,happy kid love,,1000000,766,,"NoCrop Edit Picture, Whitagram",Lyrebird Studio,,10000
2020,5082212,767,-148,Emoji Photo Sticker Maker Pro ,Emoji Photo Sticker,,1000000,767,-117,GIF Maker - GIF Editor,GIF Maker,,10000
2020,1433464,768,-380,Birthday Video Maker Song Name,Birthday Video Maker with Song Name Birthday Cards,,1000000,768,-68,Add Music to Video Background,Odyssey Apps Ltd.,,10000
2020,6443252,769,,Video Maker with Music 2023,Photo Slideshow & Photo Video Maker,,1000000,769,10,Film Camera-Analog Film,Analog Film Photo & Photo Editor & Camera,,10000
2020,7987570,770,230,Grid Photo Collage Maker Quick,MyMovie Inc.,,1000000,770,,FocoDesign: Photo Video Editor,FocoDesign,,10000
2020,7633521,771,,VideoLeap - Video Editor - Film Photo Editor,Analog Camera - Photo Editor - Filter Film Picture,,1000000,771,,Grid: Post Maker for Instagram,Dima Komar,,10000
2020,6609720,772,,Birthday Song With Name - Birthday Wishes,Sugar Candy Pops,,1000000,772,-183,Music Editor,Pony Mobile,,10000
2020,8802531,773,,画世界,"Shijiazhuang huanci Network Technology Co., Ltd",,1000000,773,,Moises: The Musician's App,Moises Systems,,10000
2020,4777048,774,,Artleap by Lightricks,Lightricks Ltd.,,1000000,774,-102,LAYÒUT,PSDC Creative Inc.,,10000
2020,7621865,775,,Vixer – Video Editor & Maker,Popixels Ltd.,,1000000,775,121,AI Enlarger: for Photo & Anime,通 张,,10000
2020,233217,776,-352,Photable- Best Body Editor,Alpha Mobile Limited,,1000000,776,-156,Pixiz - Photo montage & Collag,Pixiz,,10000
2020,675875,777,4,GIF Maker - Make Video to GIFs,Brain Craft Ltd,,1000000,777,-151,MadLipz,Eigenuity Inc.,,10000
2020,508692,778,-265,Photo Collage - Photo Frame,Smart Mobiles Tools,,1000000,778,-171,DiscDj 3D Music Player - 3D Dj,GameG,,10000
2020,8099176,779,103,LD Photo Editor,Lens Distortions,,1000000,779,,Voice Changer - Fast Tuner,Voice Changer - PMA,,10000
2020,6512032,780,,Sharingan Eyes Camera Effect,RRStudio,,1000000,780,-109,爱剪辑 – 视频修音短视频剪辑,"Sichuan Taocheng Tengfei Technology Co., Ltd.",,10000
2020,7309676,781,,3D Camera - Photo Effects,Dexati,,1000000,781,76,Logo Maker - Design Creator,Appexel App Maker,,10000
2020,8429730,782,,Aha Photo Lab,Mars City Mobile Limited,,1000000,782,,GoCut - Effect Video Editor,Like GoCut,,10000
2020,6080022,783,-526,Face Changer Gender Editor,Photolabstudios,,1000000,783,-241,EZGlitch: 3D Glitch Video & Ph,The H3D Team,,10000
2020,520766,784,,"Video Maker, Video Slideshow",BigSoft inc.,,1000000,784,-138,PIP Camera Pro.,"Fotoable, Inc.",,10000
2020,8390988,785,2,Add Audio to Video : Audio Vid,AndroTechMania,,1000000,785,,Add Text: poster maker. Flyer,Cosmoshark,,10000
2020,9030196,786,,StoryCut - Video Editor,Great Talent Video Inc. Video Editor App,,1000000,786,-133,Video maker: photo video maker,video maker - photo editor std,,10000
2020,7004758,787,,Video collage : video & photo collage maker - VIDO,video collage & collage maker Inc.,,1000000,787,143,PickU: Photo Editor & Cutout,PickU Corp,,10000
2020,8166058,788,183,Pencil Sketch Photo Editor,AZ Mobile Software,,1000000,788,,"Puma Photo Resizer, Compressor",Farluner Apps & Games,,10000
2020,5145272,789,-172,"Video to MP3 Converter, RINGTO",AppSourceHub,,1000000,789,-172,TINT - Photo Camera Retouch,Banuba,,10000
2020,5192910,790,,Wow Video Editor,FunLife Ltd.,,1000000,790,-48,AI Art Photo Editor: Selfie AI,Mivo studio,,10000
2020,8167218,791,,Navratri Photo Frame,Shepardzone,,1000000,791,,AI Art Generator & AI Avatar,VIDEOSHOW Video Editor & Maker & AI Chat Generator,,10000
2020,7223565,792,,Mostory-  Story Maker & Editor,cerdillac,,1000000,792,,Slideshow Maker: Slideshow,WECHOICE MOBILE,,10000
2020,6319555,793,,Passport Size Photo Maker,Z Mobile Apps,,1000000,793,-178,"Koda Cam-Photo Editor, 1998",Analog Film Photo & Photo Editor & Camera,,10000
2020,8072514,794,,HD Photo Editor - Pic Editor,G3G,,1000000,794,-107,美易秀图-照片编辑和视频编辑,The Little Fish Technology Inc.,,5000
2020,624253,795,,Video editor - video maker,photo music video std,,1000000,795,-131,Passport Size Photo Maker,Z Mobile Apps,,5000
2020,5672934,796,,Garden Photo Frames,App Bench,,1000000,796,-111,"Vintage Camera-Retro, Editor",Analog Film Photo & Photo Editor & Camera,,5000
2020,5763403,797,-285,Blend Collage Free,KDN Soft,,1000000,797,-106,Video Merge : Easy Video Merge,photoshop mobile apps,,5000
2020,8661489,798,,VOCHI Video Effects Editor,Pinterest,,1000000,798,,Magic Video Maker - director,APPS INNOVA,,5000
2020,6804396,799,,Voice Changer - Fast Tuner,Voice Changer - PMA,,1000000,799,-1,Betakti: Design/Write on Image,Khaled Hammad,,5000
2020,465279,800,,Face gender changer app swap,ufesia,,1000000,800,-162,Lomotif: Social Video Platform,Lomotif Pte Ltd,,5000
2020,313622,801,,"AudioApp MP3 Cutter, Ringtone ",Lyrebird Studio,,1000000,801,-227,Audio MP3 Cutter Mix Converter,AppzCloud Technologies,,5000
2020,8409339,802,-425,Video Get Pro - Private Editor,Nguyen Anh,,1000000,802,,SplitHit: Vocal Remover,Sphereo,,5000
2020,1491467,803,,Photo Video Maker with Music,beauty app inc,,1000000,803,-297,Linearity Curve Graphic Design,Linearity GmbH,,5000
2020,5581181,804,,Glitch Lab,Ilixa,,1000000,804,-234,Shapeyard: 3D Modeling,Magic Unicorn Inc.,,5000
2020,8094716,805,-290,Square Quick,Pic Collage Maker & Photo Editor,,1000000,805,,Text Photo - Photo Text Editor,AVN Software Inc,,5000
2020,7241592,806,-201,April - Layouts Photo Collage,灏 徐,,1000000,806,112,Grid Drawing,The AppGuru,,5000
2020,7988387,807,15,"Video Sound Editor: Add Audio,",AndroTechMania,,1000000,807,,Photo Retouch - AI Remove Unwa,accordion,,5000
2020,1375226,808,,Video FX-Magic Video Editor,Marcel Network Technology Limited,,1000000,808,-54,小妖精美化-情侣纪念日倒计时桌面美化主题,毅 殷,,5000
2020,4818825,809,,Birthday Video Maker,Magical.ly - lyrical video,,1000000,809,-169,Myk Video Editing for GoPro,"AI Motion, Inc.",,5000
2020,4551326,810,,Fireshot Fireworks,Paradyme Games,,1000000,810,-153,"Logo Maker, Logo Creator",Apps You Love,,5000
2020,8775080,811,,Marketing Slideshow Maker,Digital Marketing Tools,,1000000,811,,VidLight: Effect Video Editor,Sunroy limited company,,5000
2020,6821061,812,,Artisy-Photo Editor&Wallpapers,"Yesteq Co., Limited",,1000000,812,,"FotoApp Photo Editor, Filters",Lyrebird Studio,,5000
2020,5842650,813,174,"Music Video Maker, Slideshow & Video Editor",Best Photo Editor,,1000000,813,-33,"Lomopola Cam-Vintage, 1998",Analog Film Photo & Photo Editor & Camera,,5000
2020,8445366,814,,"Tattoo: Tattoo Design, Editor, Background Eraser",mert kara,,1000000,814,-119,Smart Resize - AI,Enrique Garcia,,5000
2020,5728628,815,-141,Birthday Lyrical Video Maker,Birthday Video Maker with Song Name Birthday Cards,,1000000,815,,Dubsmash - Videos for everyone,reddit,,5000
2020,8109236,816,,Cameratix,Voronova Yulia,,1000000,816,,Phinsh Photo Collage Maker,Unique Pixel Studio,,5000
2020,7903044,817,,Photo Editor,A Photo Studio,,1000000,817,,Photo Editor & Collage Maker,Video Recorder & Photo Collage,,5000
2020,115321,818,,Clay – Story Templates Frames,Plexagon s.r.l.,,1000000,818,-235,Afterlight,"Afterlight Collective, Inc",,5000
2020,8029263,819,,Feel The Swag Vid Status Maker,Feel The Swag Video Player & Editor,,1000000,819,,Compress Video Size Compressor,Inverse.AI,,5000
2020,8016638,820,,Presets for Lightroom & Filter,Inspiring Apps LLC,,1000000,820,-162,Photo Animation Studio Animate,MULTI MOBILE Ltd,,5000
2020,8318353,821,,"FX Motion: Slow, Fast Reverse Video",Konicy Media,,1000000,821,,PhotoKit : Smart Photo Editor,xPhoto Vision,,5000
2020,2515988,822,,Thumbnail Maker - Channel art,CA Publishing,,1000000,822,-162,Simple Background Changer,Photo Cool Apps,,5000
2020,582410,823,-431,Square InPic - Photo Editor & ,Studio 8 Apps,,1000000,823,-228,MP3 Cutter and Ringtone Maker,recorder & smart apps,,5000
2020,477781,824,,Happy birthday video maker,trevoldevapps,,1000000,824,-206,Video Compress,Mel studio apps,,5000
2020,5317905,825,-420,Cartoon Photo Editor - Pencil ,Ayogames,,1000000,825,-38,"Beauty Camera X, Selfie Camera",Beauty Apps Studio,,5000
2020,122123,826,-320,Sweet Selfie: Photo Editor&Cam,启鹏 梅,,1000000,826,40,图虫-好玩又赚钱的摄影社区,"Tuchong Network Technology Co., Ltd",,5000
2020,467890,827,-429,"GO Recorder – Screen Recorder,",Video Editor & Video Maker Dev,,1000000,827,,Pichero photo montage & Drip,Lyrebird Studio,,5000
2020,7542937,828,,Lyrical Photo Video Maker with Music,Nexa Studio Apps,,1000000,828,37,Photos for ID,FT Apps,,5000
2020,4009223,829,-529,Macho - Man makeover app & Pho,ANDROID PIXELS,,1000000,829,-9,Grid Post - Photo Grid Maker,AppX Studio,,5000
2020,8081761,830,-109,SlideShow Maker with Music Fx,Debotosh Dey,,1000000,830,,Video collage : video & photo collage maker - VIDO,video collage & collage maker Inc.,,5000
2020,179278,831,-152,Picsart Animator - GIF & Video,"PicsArt, Inc.",,1000000,831,-189,Catch Santa Claus in my house for Christmas,"Dualverse, Inc.",,5000
2020,8597838,832,-83,Invitation Maker,Desygner Pty Ltd,,1000000,832,-116,InFrame - Photo Editor & Frame,"INFRAME CO., LIMITED",,5000
2020,6342229,833,,Photo Effect Animation Video Maker,Effect Photo Video Maker,,1000000,833,-167,Invitation Card Maker: Ecards,photoshop mobile apps,,5000
2020,458419,834,,Face Enhancer: Blemish Remover,Pixels Dev Studio,,1000000,834,-51,Catch Santa Claus in My House,"Dualverse, Inc.",,5000
2020,9580127,835,,Tips: Wfly photo video maker - Magic Effects,Useful Division,,1000000,835,,L.O.L. Surprise! Movie Maker,Outright Games Limited,,5000
2020,337190,836,156,Acapella Maker - Video Collage,AZ Screen Recorder,,1000000,836,-261,Toolwiz Photos - Pro Editor,Toolwiz.com,,5000
2020,8439042,837,-480,Photo Editor Pro,Zentertain,,1000000,837,,Filtertune by Lightricks,Lightricks Ltd.,,5000
2020,127993,838,-279,VHS Glitch Camcorder,RAD PONY APPS - FUN APPS FOR FREE PTE. LTD.,,1000000,838,,Spring - Stylish Body Editor,kim taewan,,5000
2020,434455,839,,Photo video maker with music -,MV Master - MV Master video maker,,1000000,839,-241,InstaMag - Photo Collage Maker,"Fotoable, Inc.",,5000
2020,7278538,840,99,Logo Maker : Design Logo,Sweet Sugar,,1000000,840,-56,AudioStretch:Music Pitch Tool,BandLab Technologies,,5000
2020,7592720,841,,Photo Editor – Image to Video ,Crazy 4 U,,1000000,841,,Mivo: Face swap video bride,Mivo studio,,5000
2020,7500691,842,-214,Baby Photo Editor,Piu Piu Apps,,1000000,842,,Video Maker & Photo Music,FotoPlay Video Maker,,5000
2020,5677471,843,,Video Maker with music,Photo Video Soft Tech,,1000000,843,-265,Glitcho - Glitch Video & Photo,Huu Nguyen Chi,,5000
2020,5884914,844,,Voicemod Clips: Voice Changer,Voicemod SL.,,1000000,844,-70,Cartoon Photo Editor,AZ Mobile Software,,5000
2020,93427,845,118,Hair Color Lab Change or Dye,Alan Cushway,,1000000,845,-162,Paintwork-Sketch Drawing Pad,伟典 苏,,5000
2020,3558953,846,,Dslr Blur Photo Editor Auto,Al Razzaq Apps,,1000000,846,90,Collage Maker - Photo Editor,A Photo Studio,,5000
2020,8806746,847,,Tempi Art-Cartoon&AnimatePhoto,广州量子互娱科技有限公司,,1000000,847,,Premoment - AI Powered Photo &,Premium Moment,,5000
2020,8078556,848,,photo collage,smart tools photo collage,,1000000,848,,Background Eraser・Photo Editor,ZipoApps,,5000
2020,6630952,849,,Calligraphy,Devkrushna Infotech Private Limited,,1000000,849,-147,Ink Photo,洪跃 管,,5000
2020,5406901,850,,Video Slideshow Maker,A6Studio Entertaiment,,1000000,850,-117,Photo Compress & Resize,Lit Photo,,5000
2020,8659431,851,101,Photo Slideshow,Jenil Creation,,1000000,851,,PrettyUp - Video Body Editor,accordion,,5000
2020,8625125,852,,"Puma Photo Resizer, Compressor",Farluner Apps & Games,,1000000,852,,Veffecto Video Effects Editor,Enjoyment International Limited,,5000
2020,173612,853,,Hair Style Photo Editor,Events Basic Apps,,500000,853,-167,Hair Color Lab Change or Dye,Alan Cushway,,5000
2020,7815912,854,,Square Fit-Blur Photo Editor,Square Photo&Photo Editor Studio,,500000,854,,Node Video - Pro Video Editor,Shallway Studio,,5000
2020,728228,855,,Birthday Video Maker,Gianttlabs,,500000,855,-187,Photo Video Maker with Music,Multi Tech Apps,,5000
2020,4304101,856,,Photo Editor Pro - Kooky,ViewAI Lab,,500000,856,-178,Pic Morph - Photo Face Swap,Dexati,,5000
2020,348304,857,-528,Image To Video Movie Maker,Slideshow Solution,,500000,857,,VEdit Video Cutter and Merger,Clogica,,5000
2020,3934012,858,122,Music Ringtone Download &Maker,MMedia Tech,,500000,858,4,Logo Maker : Design Logo,Sweet Sugar,,5000
2020,6276813,859,-624,FotoRus -Camera & Photo Editor,"Fotoable, Inc.",,500000,859,-131,"Retro Camera-Analog film, Pink",Analog Film Photo & Photo Editor & Camera,,5000
2020,624251,860,-87,PicMonkey Photo + Video Design,PicMonkey,,500000,860,-178,Baby Pics,Z Mobile Apps,,5000
2020,2568449,861,-195,VNTG: Vintage Photo Editor,EASYBLUECODE S.L,,500000,861,-216,DSLR Camera Blur Effects,Photo Cool Apps,,5000
2020,624438,862,,Video Get - Maker & Editor *,Khanh Le Ngoc,,500000,862,-168,Image Combiner & Editor,ZomboDroid,,5000
2020,4735747,863,,你我当年,BigWinePot Inc,,500000,863,,3DLUT mobile,Oleg Sharonov,,5000
2020,7518922,864,-146,Rehancer: AI Photo Enhancer,Vulcan Labs Company Limited,,500000,864,5,Filmize™- Lyrical Video Status,Filmize 3D Studio,,5000
2020,6802571,865,,"Photo frame, Photo collage",video maker pvd,,500000,865,-151,DYED Editor,NOTEGG Corp.,,5000
2020,8144478,866,,Photo Collage Maker - Selfie Camera Beauty Filters,Gami Keyboard & Photo Editor,,500000,866,,VideoLeap - Video Editor - Film Photo Editor,Analog Camera - Photo Editor - Filter Film Picture,,5000
2020,454202,867,-269,Add Text on Photo,Cards,,500000,867,1,3D Camera - Photo Effects,Dexati,,5000
2020,7922183,868,-429,Painnt - Pro Art Filters,Moonlighting,,500000,868,,Retouch - Remove Objects,Kite Games Studio Ltd,,5000
2020,7409411,869,-254,Photo Cut Out Editor,丽譞 牛,,500000,869,,Orange Teal,Be Studios Montreal,,5000
2020,7679251,870,,Photo Eraser - Remove Objects,Toscana Lavori srl,,500000,870,,Baby Photo Editor,Oleg Sheremet,,1
2020,8842531,871,-19,Pins-Artistic Effects Camera,微咔世纪,,500000,871,,zShot Video Editor & Maker,Mesh Soft International LLP,,1
2020,2512836,872,,Face Beauty Makeup Camera-Self,Daily Aims,,500000,872,-291,camart - cartoon photo,Pixelab,,1
2020,8030835,873,-507,"DSLR Blur Background, Bokeh bg",Solution Cat Limited,,500000,873,-176,Sketch Master - Cartoon Photo,Dumpling Sandwich Software Inc.,,1
2020,7520108,874,67,AE M9,AE M9,,500000,874,15,Sticker Maker- Creator Studio,Picthug Pte Ltd,,1
2020,7285757,875,,Slow Motion Video Fx Editor,Brain Craft Ltd,,500000,875,-5,Inked: Tattoo My Photo,Photo Cool Apps,,1
2020,617393,876,,Editin Photos,Vanila iTech,,500000,876,-26,True Love Photo Frames Editor,XEN Studios,,1
2020,4477323,877,,Invitation Maker Greeting Card,"Hangzhou Lemi Network Technology Co., Ltd",,500000,877,-72,Fireshot Fireworks,Paradyme Games,,1
2020,617390,878,-135,BeFunky,BeFunky Inc,,500000,878,22,Birthday Video Maker with Song,XEN Studios,,1
2020,5878906,879,,Superhero Camera Photo Editor,YOLY Studio,,500000,879,-223,TELEVI 1988 - VHS Camcorder,Sangwon Kang,,1
2020,13351222,880,-424,Garden Photo Frames Editor,Solution Photo Apps,,500000,880,-69,OVF Editor,Mutaeb Alqahtani,,1
2020,5848514,881,-159,Slomo - Music & Video Editor,"Chongqing Caishu Technology Co., Ltd",,500000,881,-180,Automatic Background Changer,Automatic Background Changer,,1
2020,8099428,882,-13,Video Converter - mp4 to mp3,俊杰 阮,,500000,882,,Square Fit-Blur Photo Editor,Square Photo&Photo Editor Studio,,1
2020,597763,883,,ProCam - AI Photo Editor,Thenware Mobile Limited,,500000,883,-83,Photo Wobble Editor - Jellify,Vacuapps s. r. o.,,1
2020,4233277,884,,Photos Editor & Collage Maker.,AppStar Studios,,500000,884,-114,Photo Retouch : Remove Objects,俊杰 阮,,1
2020,918013,885,-481,Photo Editor Pro,Dreams Room,,500000,885,-176,VideoJoiner - HD Video Editor,Farooq Ahmad,,1
2020,8158866,886,,FaceArt: Photo Editor&Hair,Dawn Key Limited,,500000,886,,Remove Objects,TAPUNIVERSE LLC,,1
2020,3388886,887,-281,GIF Maker by Momento,Popixels Ltd.,,500000,887,-276,1888 Cam - Classic Film Camera,LI HUNG WANG,,1
2020,6315502,888,,Photo frames lab editor,APPDEVELOPER202,,500000,888,-123,Video Clip Editor - Film maker,书勇 贾,,1
2020,6122371,889,-318,MP4 Video Cutter,Movies Studio,,500000,889,-93,Pencil Sketch Photo Editor,AZ Mobile Software,,1
2020,7785040,890,,Tattoo Maker - Tattoo On Photo,PDF Reader & PDF Scanner - Snap Photo Editor,,500000,890,,Blur Photo Editor & Auto Blur,Kite Games Studio Ltd,,1
2020,6789833,891,,RuRu Camera,Liu Hua,,500000,891,-199,"Glitch VHS-Vapor, 90s, Retro",Analog Film Photo & Photo Editor & Camera,,1
2020,1627527,892,,Lift: Reels & Stories Maker,FUNPLACEAPP LIMITED,,500000,892,-167,Snapshot Santa - Photo Editor!,Simon Crack,,1
2020,4939204,893,,Happy Diwali Photo Frame,MexPro Inc.,,500000,893,-39,Rainbow Camera,Creative Art Studio,,1
2020,8436607,894,,Hi Video - Cartoon Filter,Unbing Ltd,,500000,894,,Coco Editor,海妮 黄,,1
2020,7336270,895,-763,Photo Frames: Hoarding & Photo,Studioapps,,500000,895,,Icon: ваша совместимость,Dmitriy Pogosyan,,1
2020,7046982,896,16,PK Film: Movie Video Maker,PK Master,,500000,896,-80,Trim Video & Crop Video,Volio Mobile Apps - Govo Tech,,1
2020,5744426,897,,TouchNote Custom Cards & Gifts,TouchNote Ltd,,500000,897,-191,Baby Photo Editor,Piu Piu Apps,,1
2020,9320779,898,,Photograph Labs Pro,VIRALPATEL,,500000,898,,Colorize:  Old Photo Colorizer,通 张,,1
2020,5433326,899,-367,Frame Art: Collage Editor,CAM EDITOR STUDIO,,500000,899,,Smart Video Crop - Video Cut,Clogica,,1
2020,5186959,900,-133,简影-Video Editor,北京简影优视科技有限公司,,500000,900,-145,"Photo Resizer: Crop, Resize, S",Z Mobile Apps,,1
2020,5737896,901,,"Photo collage, photo PIP & pho",Collage maker & Photo frame,,500000,901,-254,Beauty Camera: Selfie Editor,Social Media Apps Studio,,1
2020,3880207,902,-74,photo editor with music,photovideoslide,,500000,902,-162,Face Blemish Remover - Smooth ,Simply Entertaining Apps,,1
2020,274633,903,,Photoly Remove Object & Editor,DATAFIX YAZILIM HIZMETLERI,,500000,903,-222,Add Text on Photo,Cards,,1
2020,8426769,904,-507,Video Maker Photos With Song,Media Maker Apps,,500000,904,,MVBit - MV video status maker,mvbit,,1
2020,571267,905,,FotoArt-Photo Editor&Wallpaper,Volker Mobile Limited,,500000,905,-200,Pixgram- video photo slideshow,Swiitt Computing Inc.,,1
2020,7492837,906,,图怪兽-海报设计、图片视频编辑器工具,"Shanghai yutu network technology Co., Ltd.",,500000,906,,FocoVideo – Music Video Editor,FocoVideo,,1
2020,294199,907,,Collage Maker- Photo Collage,Photo Editor Perfect Corp.,,500000,907,-186,MediaCrop,Amalgam Apps,,1
2020,7548995,908,,Vakie-Music Video Maker,"Hangzhou Yingqu Internet Technology Co.,Ltd.",,500000,908,-130,Christmas Dance – Happy Moves,Pablex Studio 3D,,1
2020,4773988,909,,Video Maker - Photo Video with Music and Text,Whitney Silver,,500000,909,,Grid Maker,KMD Apps,,1
2020,8648664,910,,Youbit : Video Status Maker 2021,Photo Video Status Maker,,500000,910,,Video Compressor – Reduce Size,Technozer Solution,,1
2020,8105646,911,,FrameArt: Photo Editor & Frame,Photo Editor Perfect Corp.,,500000,911,,Benime-Whiteboard Video Maker,Benzveen,,1
2020,8355381,912,,Rajasthani Turban Photo Editor,Astone Martine,,500000,912,,Video Compressor & Converter : Fast Compress Video,TechPlus Developers,,1
2020,9537496,913,-707,StoryZ Photo Motion Video loop,AndOr Communications Pvt Ltd,,500000,913,-169,تيوب داون,hazem lubaed,,1
2020,11018860,914,-520,Slideshow Maker w Music,Md. Mahmudur Rahman,,500000,914,-197,Camera Filters and Effects,CA Publishing,,1
2020,4972893,915,-12,Filmm | Easy Video Editing App,"Filmm, LLC",,500000,915,-184,Add Audio to Video : Audio Vid,AndroTechMania,,1
2020,4927391,916,,"Enhance Photo Quality, Upscale",Csmartworld,,500000,916,-201,Square Quick,Pic Collage Maker & Photo Editor,,1
2020,11111522,917,-416,Emoji Photo Editor,FRM ART,,500000,917,-154,برنامج دمج الصور - مصمم اطارات,Adeeb Haddad,,1
2020,7843079,918,-613,Crown Heart Photo Editor,FRM ART,,500000,918,,Dazz Cam ‎,Dazz Cam,,1
2020,10175198,919,,photo editor with song,photovideoslide,,500000,919,-72,Love photo Frames Photo Editor,Xilli Apps,,1
2020,8481550,920,-288,Pocket Video Editor & Maker,Fitness Labs,,500000,920,,Enhance it - AI Photo Editor,Battery Stats Saver,,1
2020,4048105,921,-137,Audio Editor Tool: Edit Music,Music Breath,,500000,921,-139,ID Photo-Passport Photo maker,苏娟 陈,,1
2020,1290886,922,-115,Typorama: Text on Photo Editor,App Business Ventures LLC,,500000,922,-223,Photo Sketch Maker,Aero Tools,,1
2020,8115859,923,-195,Blur Photo Background,SUNWOONG JANG,,500000,923,,"AudioApp MP3 Cutter, Ringtone ",Lyrebird Studio,,1
2020,8727393,924,,Pixllab,Klavdiia Guliaeva,,500000,924,,Vidmix - AI Art & MV Maker,Music Video Studio,,1
2020,6328950,925,65,Crazy Helium Funny Face Voice,Appkruti Solutions LLP,,500000,925,-165,Retouch - Smart Eraser Tool,kyoung hee park,,1
2020,706937,926,,Nature photo editor and frames,Voolen Studios Pvt Ltd,,500000,926,-194,Professional Photo Retouch Ser,Retouchit LLC,,1
2020,5045010,927,-371,Birthday Photo Frame Maker,ZipoApps,,500000,927,-189,Video Speed : Fast Video and S,AndroTechMania,,1
2020,7987375,928,,mAst: Music Status Video Maker,mAst Team,,500000,928,,Ptime - Photo Jigsaw Artifact,"Shenzhen Pindede Technology Co., Ltd.",,1
2020,2174155,929,,Maker Video with Music Photos,Team Media Social,,500000,929,-30,Tattoo My Photo,photoshop mobile apps,,1
2020,5574830,930,-321,VidTrim Pro - Video Editor,Goseet,,500000,930,-169,"Video Sound Editor: Add Audio,",AndroTechMania,,1
2020,8135487,931,,"Birthday Cake with Name, Photo",Mobi Pixler Studio,,500000,931,,Photo Editor  - Filters & Effe,vyro.ai pvt ltd,,1
2020,7181030,932,-4,Biometric Passport Photo,Vitalij Schaefer,,500000,932,,Photo Eraser - Remove Objects,Toscana Lavori srl,,1
2020,1363849,933,-400,Crop Video: Cropper and Cutter,"Easy Tiger Apps, LLC.",,500000,933,-206,Text Only For Instagram,Batbayar Batbaatar,,1
2020,7330299,934,,Photograph labs Plus,Yasar Nagori,,500000,934,,Glitch Photo Editor - Vintage,Fillog Studio,,1
2020,4024097,935,-372,Name Art Photo Editing App,AppTrendz Studio,,500000,935,-292,Psychedelic camera,ziro div,,1
2020,8694887,936,,Collage Maker - Photo Editor,Fitness Labs,,500000,936,-226,Photo Art: Picture Editor,万利 彭,,1
2020,6608352,937,,Graphic Designer - Logo Maker,技 柯,,500000,937,-135,Video & Image compressor size,appsRock,,1
2020,7940174,938,,Smokey - Lyrical Video Status Maker & Editor,Smokey Video Status Maker,,500000,938,,Boomerang Videos Creator,Appside Technologies LTD,,1
2020,6242993,939,,Compress Image Size in kb & mb,AOne Scanner,,500000,939,-4,Photo Video Maker With Music,Eco Mobile,,1
2020,247643,940,,剪影 - 视频剪辑 & 卡点影集制作,"Shanghai Jian Ji Software Technology Co., Ltd",,500000,940,-279,视频剪辑 - 视频剪裁 & 视频拼接神器,立乾 董,,1
2020,1343798,941,-488,1967: Retro Filters & Effects,"Maple Media, LLC",,500000,941,-160,Muse - Music & Video Editor,John Galliano,,1
2020,210705,942,,"Beauty Camera X, Selfie Camera",Beauty Apps Studio,,500000,942,-109,MotionPortrait,"MotionPortrait, Inc.",,1
2020,10568814,943,-367,Video Converter,VidSoftLab,,500000,943,-223,B612 AI Photo&Video Editor,SNOW Corporation,,1
2020,4964166,944,,Phinsh Photo Collage Maker,Unique Pixel Studio,,500000,944,-233,Cut and Paste Photos,ZipoApps,,1
2020,7519106,945,,Add Text: Write On Photos,Appostrophe AB,,500000,945,,"Video Maker: Video Editor, Remove Background, Clip",Honor Mob Company,,1
2020,438037,946,,ID photo background editor,siranet,,500000,946,-119,Video Merge - Side By Side,Iris Studios and Services,,1
2020,7241400,947,,Tailor-auto screenshot stitch,Dehui Chengzhen,,500000,947,-45,Crown Heart Photo Editor,Volio Mobile Apps - Govo Tech,,1
2020,7681419,948,-18,Linearity Curve Graphic Design,Linearity GmbH,,500000,948,,Audio Editor - Music editor,苏娟 陈,,1
2020,7256623,949,-307,Photo Collage Maker - Collages,gPhotos Inc.,,500000,949,,Collage Maker - Photo Collage,Fillog Studio,,1
2020,7746070,950,,اضافة الموسيقى الى الفيديو,VidMob,,500000,950,,Birthday Video Maker with Song and Name,Woogle Lab,,1
2020,7223320,951,-138,一键水印-专业水印视频编辑大师,"Chongqing tuanshui technology Co., Ltd.",,500000,951,-617,InstPop - Get Followers' Best Liked Avatars Style,Brody None,,1
2020,5062371,952,,Face X Play - Aging & Cartoon Selfie,Face X Studio,,500000,952,-151,Magazine Maker - Photo Editor,Haavard Moland,,1
2020,7664804,953,-357,Photo Sketch Maker,Aero Tools,,500000,953,,Video Invitation Maker,JVR Developers,,1
2020,141669,954,,Sunset Photo Editor - Frames,Benzyl Labs,,500000,954,-211,Make Me Old Face Photo Montage,Thalia Premium Photo Montage,,1
2020,8123877,955,,"Video Maker, Video Slideshow",Video Maker & Music Player,,500000,955,,Video Splitter for WhatsApp,Tomin,,1
2020,7200026,956,-273,Beauty Smooth camera - Selfie ,Psii,,500000,956,-266,VideoShot - Long videos (by Zo,Zoomerang apps,,1
2020,7142223,957,-495,Bridal Dress Suit Photo Editor,XEN Studios,,500000,957,,Instant Photo Grid Maker,JP's Apps,,1
2020,702368,958,,Photo slideshow with music - Slideshow Creator,Alex Ulrich,,500000,958,,Photo Collage - collage maker,NewX Heights,,1
2020,7518855,959,,Pictasia,amolmistri,,500000,959,-52,Cartoon Photo Editor: AIFX,AIFX,,1
