Year,App ID,Top Free Number,Top Free Different,Top Free Name,Top Free Publisher,Top Free Tags,Top Free Downloads,Top Grossing Number,Top Grossing Different,Top Grossing Name,Top Grossing Publisher,Top Grossing Tags,Top Grossing Revenue
2019,10569352,23,-10,Meitu- Photo Editor & AI Art,"Xiamen Meitu Technology Co., Ltd.",,20000000,23,4,Video Editor & Maker - InShot,InShot Inc.,,5000000
2019,7540719,24,,剪映 - 轻而易剪,深圳市脸萌科技有限公司,,20000000,24,164,Prequel: Photo & Video Editor,Prequel Inc.,,5000000
2019,3240591,25,-7,Boomerang from Instagram,Instagram,,20000000,25,7,Lightleap by Lightricks,Lightricks Ltd.,,5000000
2019,6087578,26,12,Collage Maker | Photo Editor,Photo Editor & Collage Maker,,20000000,26,301,Splice - Video Editor & Maker,Bending Spoons Apps ApS,,5000000
2019,6022593,27,-5,Photo Lab Picture Editor & Art,Linerock Investments LTD,,20000000,27,15,Unfold: Reels & Story Editor,"Squarespace, Inc.",,5000000
2019,81815,28,68,Motionleap by Lightricks,Lightricks Ltd.,,20000000,28,-14,GoPro Quik: Video Editor,"GoPro, Inc.",,5000000
2019,7183903,29,179,AI Art Generator - Lyrical.ly,lyrical.ly,,20000000,29,,Selfie Art - Photo Editor,Amila Mobile Limited,,5000000
2019,13789650,30,-9,YouCam Makeup - Selfie Editor,PERFECT MOBILE CORP.,,20000000,30,-7,Photo Collage - Collageable,IRONTECH LIMITED,,5000000
2019,106718,31,-4,轻颜相机-风格自拍新潮流,深圳市脸萌科技有限公司,,20000000,31,-3,"Bazaart: Design, Photo & Video",Bazaart Ltd.,,2000000
2019,6639129,32,-6,YouCam Perfect: Beauty Camera,PERFECT MOBILE CORP.,,20000000,32,8,"Facelab - Face Editor, Beauty",IRONTECH LIMITED,,2000000
2019,9967725,33,-8,SNOW - AI Profile,SNOW Corporation,,20000000,33,113,Easysnap: Retouch Photo Editor,Smertrios,,2000000
2019,229652,34,0,Photo Video Editor,Video Note LLC,,20000000,34,-15,Photo Scan App by Photomyne,Photomyne LTD,,2000000
2019,729172,35,,PickU: Photo Editor & Cutout,PickU Corp,,20000000,35,-20,Photo Lab Picture Editor & Art,Linerock Investments LTD,,2000000
2019,6083978,36,10,PowerDirector - Video Editor,Cyberlink Corp,,20000000,36,15,BeautyPlus-AI Photo/Video Edit,Pixocial Technology Singapore Pte Ltd,,2000000
2019,6619901,37,-9,Music Video Maker: Slideshow,Video Note LLC,,20000000,37,,Facetasy Camera: Take & Edit,"Yunnan Xinding Hengsheng Technology Co.,ltd.",,2000000
2019,213131,38,-19,"Sweet Camera - Selfie Beauty Camera, Filters",iHandy Inc.,,20000000,38,10,LumaFusion,Luma Touch LLC,,2000000
2019,6354627,39,9,Background Eraser,handyCloset Inc.,,20000000,39,,Photolift - Face & Body Editor,Mimoza Bilgi Teknolojileri Limited Sirketi,,2000000
2019,830074,40,-5,"Quik – Free Video Editor for photos, clips, music","GoPro, Inc.",,20000000,40,-32,Photable- Best Body Editor,Alpha Mobile Limited,,2000000
2019,1414735,41,-21,Camera360-Selfie Editor,灏 徐,,20000000,41,-20,Movie Maker:Video Editing Apps,爱剪辑,,2000000
2019,45696,42,86,YouCut - Video Editor & Maker,InShot Inc.,,20000000,42,-11,PicPlayPost: Video Editor,Mixcord Inc.,,2000000
2019,6207750,43,,"VStatus - Compartilhe Vídeos, Baixe Status",XYZ ONLINE,,20000000,43,397,Boosted Ad Maker by Lightricks,Lightricks Ltd.,,2000000
2019,225816,44,-5,Photo Collage Maker & Editor,Lyrebird Studio,,10000000,44,-9,PicCollage: AI Collage Maker,Cardinal Blue,,2000000
2019,626659,45,12,Magisto Video Editor & Maker,"Vimeo, Inc.",,10000000,45,22,Word Swag - Cool Fonts,Oringe Inc.,,2000000
2019,5296925,46,-38,"DU Recorder – Screen Recorder, Video Editor, Live",Screen Recorder & Video Editor,,10000000,46,159,X Photo Editor - Cartoon Effect & Face Aging,X Pic Studio,,2000000
2019,2609589,47,73,Funimate Video & Motion Editor,Pixery Bilgi Teknolojileri,,10000000,47,-31,Manly- Best Body Editor,Alpha Mobile Limited,,2000000
2019,152970,48,10,"Filmora：AI Video Editor, Maker",FilmoraGo Studio,,10000000,48,103,Collage Maker - LiveCollage,VIDEO EDITOR PTE. LTD.,,2000000
2019,5949645,49,442,Smarty Man Editor App Maker,Appwallet Technologies,,10000000,49,476,Mojo — Reels & Stories Maker,Archery Inc.,,2000000
2019,2356767,50,-9,PicCollage: AI Collage Maker,Cardinal Blue,,10000000,50,33,Collage Maker - Mixgram,Lyam Apps,,2000000
2019,6599025,51,-22,Photo Editor Collage: Picsa,Lyrebird Studio,,10000000,51,55,"Grids: Giant Square, Templates",TapLab,,2000000
2019,6448495,52,10,AirBrush - AI Photo Editor,Pixocial Technology Singapore Pte Ltd,,10000000,52,,Phonty - Perfect Photo Editor,Senfoni,,2000000
2019,7998923,53,-13,BeautyCam - Beautify & AI Art,"Xiamen Meitu Technology Co., Ltd.",,10000000,53,15,PowerDirector - Video Editor,Cyberlink Corp,,2000000
2019,7041279,54,86,Videoleap: AI Video Editor,Lightricks Ltd.,,10000000,54,,"OopsCam - Art Filter,Age Magic","Vela Technology Co.,Limited",,2000000
2019,10568867,55,,MBit Music Video Status Maker,MBit Music Inc.,,10000000,55,-16,VideoShow Video Editor & Maker,VIDEOSHOW PTE. LTD.,,2000000
2019,10554396,56,-1,Candy Camera - photo editor,Studio SJ,,10000000,56,-2,Video Maker Music Video Editor,VIDEOSHOW Video Editor & Maker & AI Chat Generator,,2000000
2019,8038188,57,14,Unfold: Reels & Story Editor,"Squarespace, Inc.",,10000000,57,-19,Retouch Me: Body & Face Editor,Good Retouch LP,,2000000
2019,6547007,58,-25,Retrica-Original Filter Camera,"Retrica, Inc.",,10000000,58,-29,Filterra- Filters for Pictures,IRONTECH LIMITED,,2000000
2019,4403098,59,22,Wonder Video Editor Crop Video,Video Editor & Video Maker Dev,,10000000,59,20,Wonder Video Editor Crop Video,Video Editor & Video Maker Dev,,2000000
2019,101672,60,40,PixelLab - Text on pictures,App Holdings,,10000000,60,-13,Filmmaker Pro - Video Editor,Tinkerworks Apps,,2000000
2019,5324669,61,22,Cute CUT,波 余,,10000000,61,20,BodyApp- Best Body Editor,Alpha Mobile Limited,,2000000
2019,6031680,62,802,X Photo Editor - Cartoon Effect & Face Aging,X Pic Studio,,10000000,62,-36,VHS Glitch Camcorder,RAD PONY APPS - FUN APPS FOR FREE PTE. LTD.,,1000000
2019,7463525,63,,Boo - Video Status Maker,The One World Apps,,10000000,63,85,Video Crop – Trim &amp; Cut Videos,Muhammed Nyeem Hassan,,1000000
2019,1317383,64,,Video Downloader : Downloader,Music Online Studios Inc.,,10000000,64,-31,Cute CUT,波 余,,1000000
2019,7200954,65,-5,InstaSize AI Photo Editor＋Crop,Instasize Inc.,,10000000,65,,FunShot+: Cartoon & Hairstyle,FunShot Team,,1000000
2019,6097234,66,82,Selfie Camera - Beauty Camera,KX Camera Team,,10000000,66,-6,Videoshop - Video Editor,Jajijujejo Inc.,,1000000
2019,6795009,67,20,Splice - Video Editor & Maker,Bending Spoons Apps ApS,,10000000,67,,Mask Studio,Modernist LTD,,1000000
2019,5232707,68,136,Lightleap by Lightricks,Lightricks Ltd.,,10000000,68,93,Tezza: Aesthetic Photo Editor,Tezza App LLC,,1000000
2019,6052210,69,-27,"FaceFun - Face Filters, Selfie Editor, Sweet Cam",ONE App Team,,10000000,69,64,Slideshow Maker w Music,Md. Mahmudur Rahman,,1000000
2019,779226,70,75,Photo Video Maker with Music,Multi Tech Apps,,10000000,70,-21,"Prisma: Photo Editor, Filters","Prisma labs, inc.",,1000000
2019,214626,71,462,StoryArt - Insta story maker,cerdillac,,10000000,71,43,PhotoGrid: Video Collage Maker,"KS Mobile, Inc.",,1000000
2019,6598860,72,37,Pencil Photo Sketch : Drawing,Minerva Studios Private Limited,,10000000,72,26,Filterloop: Photo Editor,TapLab,,1000000
2019,8117320,73,,Video Editor - Video Effects,InShot Inc.,,10000000,73,22,YouCam Perfect: Beauty Camera,PERFECT MOBILE CORP.,,1000000
2019,14110,74,36,Video Maker: Photo Music Video,Video Maker (videomaker.cool),,10000000,74,31,Adobe Express: Graphic Design,Adobe,,1000000
2019,85667,75,-8,iMovie,Apple,,10000000,75,-1,Baby Pics - Photo Editor,Baby Pics,,1000000
2019,7121589,76,-22,Foodie - Filter & Film Camera,SNOW Corporation,,10000000,76,,Selfiemoji - Cartoon Maker,Frontier Network Technology Limited,,1000000
2019,12966941,77,54,Photo Frame - Photo Collage,highsecure,,10000000,77,-33,Font Candy Photo & Text Editor,Fonts ApS,,1000000
2019,5436324,78,38,Efectum – Video Editor & Maker,Craigpark Limited,,10000000,78,10,ChatUP - Text & emoji to video,Gototop LTD,,1000000
2019,10285678,79,1,Phonto - Text on Photos,youthhr,,10000000,79,68,"VLLO, My First Video Editor",vimosoft,,1000000
2019,729192,80,133,Video to MP3 - Video to Audio,InShot Inc.,,10000000,80,64,Camera360-Selfie Editor,灏 徐,,1000000
2019,5760125,81,79,FaceU - Inspire your Beauty,Bytedance Pte. Ltd.,,10000000,81,327,Video Editor ·,Luni,,1000000
2019,6098838,82,393,"Photo frame, Photo collage",lsla - photo & video maker,,10000000,82,87,Crop Video: Cropper and Cutter,"Easy Tiger Apps, LLC.",,1000000
2019,6008976,83,8,PhotoScan by Google Photos,Google LLC,,10000000,83,435,"Lensa AI: photo editor,avatars","Prisma labs, inc.",,1000000
2019,105046,84,,Wemoji - WhatsApp Sticker Make,Picmax,,10000000,84,-25,A Color Story: Photo + Video,A Color Story LLC,,1000000
2019,22778,85,-41,MadLipz,Eigenuity Inc.,,10000000,85,-49,LINE Camera - Photo editor,LINE Corporation,,1000000
2019,7186659,86,-37,MakeupPlus - Virtual Makeup,"Xiamen Meitu Technology Co., Ltd.",,10000000,86,-49,Add Music To Video Editor,Add Music to Video Maker & Editor LLC,,1000000
2019,6574485,87,21,Photo Video Maker with Song™,Silveroot Softwares,,10000000,87,,Magi+: Magic Video Editor,"Wuhan Bigebang Technology Co., Ltd.",,1000000
2019,8346131,88,-32,Faceu - Cute stickers camera,深圳市脸萌科技有限公司,,5000000,88,-58,Edit Lab Picture Photo Editing,Sotec Consulting S.L,,1000000
2019,880451,89,245,Face Makeup Camera & Beauty Photo Makeup Editor,YouMakeup Studio,,5000000,89,-37,1 Second Everyday Diary,"1 Second Everyday, P.B.C.",,1000000
2019,6119438,90,-29,PIP Camera Pro.,"Fotoable, Inc.",,5000000,90,263,Filto:Photo&Video Filters Edit,"Pinso, Inc.",,1000000
2019,228061,91,-48,Huji Cam,"Manhole, Inc.",,5000000,91,-22,Typorama: Text on Photo Editor,App Business Ventures LLC,,1000000
2019,7974354,92,-40,Photo Frames,Visu Entertainment,,5000000,92,263,Splicer Funny Video Meme Maker,PIL PARAMOUNT INVESTMENTS LIMITED,,1000000
2019,5098453,93,25,Video Star,Frontier Design Group,,5000000,93,-30,Facey: Face Editor &Makeup Cam,Alpha Mobile Limited,,1000000
2019,7001335,94,109,Video Maker,InShot Inc.,,5000000,94,,PicsX-Cartoon Filters&Face App,HK YZX LIMITED,,1000000
2019,3583956,95,89,Collage Maker Photo Editor App,Pic Collage Maker & Photo Editor,,5000000,95,7,MoShow Slideshow Photo & Video,Picadelic,,1000000
2019,6097435,96,152,"Photo collage, Photo frame",Photo collage maker & photo frame,,5000000,96,-2,Poster Maker- Flyer Designer!!,Vidthug Pte Ltd,,1000000
2019,9135186,97,-29,InstaBeauty - Makeup Camera!,"Fotoable, Inc.",,5000000,97,304,Sweet Selfie: Photo Editor&Cam,启鹏 梅,,1000000
2019,5924674,98,-53,B612咔叽 - 点缀你的自然美,"Yiruike Information Technology (Beijing) Co., Ltd.",,5000000,98,5,GIF Maker - Make Video to GIFs,Brain Craft Ltd,,1000000
2019,73432,99,,"Magikoly – Age App, Cartoon Filter, Totem Animal",Chichong Studio,,5000000,99,-53,Visage: airbrush photo maker,Linerock Investments LTD,,1000000
2019,1566479,100,11,Photo Video Maker With Music-Movie Maker,Riberry Developer,,5000000,100,-47,Affinity Photo,Serif Labs,,1000000
2019,4993285,101,-23,Video to MP3 Converter,accountlab,,5000000,101,6,Pinso Poster:Flyer&Ads Creator,"Pinso, Inc.",,1000000
2019,4562819,102,565,Storybeat Reels & Story Maker,Storybeat,,5000000,102,118,Zoomerang - Ai Video Maker,"Zoomerang, Inc.",,1000000
2019,7726691,103,,ZAO - 超好玩！,"Beijing Momo Technology Co., Ltd.",,5000000,103,-33,TouchRetouch,ADVA Soft GmbH,,1000000
2019,1620424,104,-38,LINE Camera - Photo editor,LINE Corporation,,5000000,104,-24,GIF Maker by Momento,Popixels Ltd.,,1000000
2019,8333268,105,2,Pencil Sketch,Dumpling Sandwich Software Inc.,,5000000,105,,InStories Reels & Story Maker,Ylee Studio LTD,,1000000
2019,5618204,106,660,"Mirror: Emoji maker, Stickers",Mirror AI,,5000000,106,,Funny Clip Maker,FUNPLACEAPP LIMITED,,1000000
2019,7188640,107,,Facetify - Makeup &amp; Selfie,Onekitty International Limited,,5000000,107,,illus - Face Effects Editor,"Inmoji Co.,Ltd",,1000000
2019,8330430,108,-19,Audio MP3 Cutter Mix Converter,AppzCloud Technologies,,5000000,108,,SmartPics Photo Editor,Coolcat,,1000000
2019,654531,109,216,Intro Maker -video intro outro,cerdillac,,5000000,109,-51,Hobnob: Invitation Maker,Hobnob Events,,1000000
2019,7998928,110,22,Body Editor - Photo Editor,Photo Editor & Collage Maker,,5000000,110,,Ulike - Define your selfie in ,Bytedance Pte. Ltd.,,1000000
2019,5415691,111,-42,Cymera - Photo Editor Collage,SK Communications,,5000000,111,111,StoryArt - Insta story maker,cerdillac,,1000000
2019,9414557,112,-27,Cut Paste Photo Seamless Edit,Peml Art FZC LLC,,5000000,112,,StoryChic - IG Story Templates,"Hangzhou Yunxiang Technology Co., Ltd",,1000000
2019,6063804,113,,Photo video maker,photo music video std,,5000000,113,84,Slideshow Add Music to Photos,"Easy Tiger Apps, LLC.",,1000000
2019,228730,114,-24,Adobe Photoshop Fix,Adobe,,5000000,114,111,黄油相机,北京缪客科技有限公司,,1000000
2019,3567348,115,,Automatic Background Changer,Automatic Background Changer,,5000000,115,-72,Afterlight Photo Editor,"Afterlight Collective, Inc",,500000
2019,182731,116,-14,Photo Slideshow with Music,Opals Apps,,5000000,116,-43,"Piczoo-Photo Edit,Pic Collage","Xi'an Button Software Technology Co., Ltd.",,500000
2019,6574188,117,-12,"Adobe Photoshop Mix - Cut-out,",Adobe,,5000000,117,,Funny Video Maker - JokeFaces,Mimoza Bilgi Teknolojileri Limited Sirketi,,500000
2019,8694588,118,-21,Polarr: Photo Filters & Editor,"Polarr, Inc.",,5000000,118,-84,Slow Motion Video Editor SLOMO,App Dynatics LLC,,500000
2019,227961,119,-69,Dubsmash - Videos for everyone,reddit,,5000000,119,-28,Slideshow Maker (SlidePlus),QuVideo Inc. Video Editor & Video Maker App,,500000
2019,110495,120,101,Video Editor - Video Maker,FUNVIDEOAPP STUDIO,,5000000,120,-56,PicMonkey Photo + Video Design,PicMonkey,,500000
2019,118332,121,-46,PhotoDirector: AI Photo Editor,Cyberlink Corp,,5000000,121,-28,Polarr: Photo Filters & Editor,"Polarr, Inc.",,500000
2019,4194179,122,11,Song Video Maker - Photo Video,GrowUp Infotech,,5000000,122,49,No Crop – Video & Pictures Fit,Debotosh Dey,,500000
2019,959347,123,-91,Photo Editor - Beauty Camera & Photo Filters,Pic Tools Group (Photo Editor& Photo Grid&Collage),,5000000,123,30,"uMake: 3D Modeling CAD, Design",UMake,,500000
2019,15837,124,442,Z Camera - Photo Editor Pro,Funnytech Corporation,,5000000,124,-49,Stop Motion Studio,Cateater,,500000
2019,6083466,125,-94,LightX Photo Editor Make Video,AndOr Communications Pvt Ltd,,5000000,125,-3,Watermark Photo: Add Copyright,Ezyabsorb PTE LTD,,500000
2019,6087557,126,242,Cut and Paste Photos,ZipoApps,,5000000,126,-54,Picsee-Add text on photos,"Xi'an Button Software Technology Co., Ltd.",,500000
2019,2576358,127,,"Video Editor With Music App, Video Maker Of Photo",Arrow Frankie,,5000000,127,37,SlideShow Maker with Music Fx,Debotosh Dey,,500000
2019,6619456,128,,Photo Suite Editor,Mobi Softech,,5000000,128,,Get Squiggle Brush for Photos,Samuel Baker,,500000
2019,6097537,129,,PicsHub-AI Art & Photo Edit,Onekitty International Limited,,5000000,129,-14,Invitation Maker: Card Creator,Picthug Pte Ltd,,500000
2019,6097153,130,-18,GoPro Quik: Video Editor,"GoPro, Inc.",,5000000,130,-54,Trim and Cut Video Editor,"Easy Tiger Apps, LLC.",,500000
2019,6138087,131,471,Makaron-Photo & Video Editor,"Versa, Inc.",,5000000,131,63,Body Tune - Photo Editor,"Face & Body Tune Photo Editor, Societatea cu Raspundere Limitata",,500000
2019,7382338,132,3,Photo Frames: Hoarding & Photo,Studioapps,,5000000,132,,RecShot-Cartoon Effect&Sticker,Starpool Data Limited,,500000
2019,5040998,133,572,快影-创作有趣的视频,"Beijing Kwai Technology Co., Ltd.",,5000000,133,123,"iArt Camera-Magic Effect, Face Aging Booth",Voyage Photo Lab,,500000
2019,6660987,134,473,Blend Me Photo Editor,Gajrup apps,,5000000,134,,"Magikoly – Age App, Cartoon Filter, Totem Animal",Chichong Studio,,500000
2019,6547008,135,164,Beard Man: Beard Styles Editor,Droid-Developer,,5000000,135,-25,FLMX - Video Editor,UTILITY APPS LP,,500000
2019,7269444,136,677,Prequel: Photo & Video Editor,Prequel Inc.,,5000000,136,,Rehancer: AI Photo Enhancer,Vulcan Labs Company Limited,,500000
2019,223063,137,-38,PhotoGrid: Video Collage Maker,"KS Mobile, Inc.",,5000000,137,71,VUE - vlog &amp; video editor,"VUE VIDEO CO., LTD.",,500000
2019,8013276,138,684,"iArt Camera-Magic Effect, Face Aging Booth",Voyage Photo Lab,,5000000,138,-60,Music Maker JAM: Beatmaker app,Loudly,,500000
2019,8848150,139,-47,Romantic Love Photo Frames,Visu Entertainment,,5000000,139,26,Dupa - Video editor & Maker,"Shenzhen Kaililai Network Technology Co., Ltd.",,500000
2019,8957656,140,180,Fancy Photo Editor - Collage Sticker Makeup Camera,i Dev.,,5000000,140,3,Teleprompter & Video Captions,BIGVU AI Subtitles & Prompter,,500000
2019,1587552,141,562,Instasquare Photo Editor: Neon,Lyrebird Studio,,5000000,141,1,Movavi Clips Edit Video Editor,Movavi Emea LLC,,500000
2019,115062,142,,Screen Recorder-My VideoRecord,MyMovie Inc.,,5000000,142,-58,"Perfect Video Editor, Collage",银峰 汤,,500000
2019,8182997,143,,"Video Maker from Photos, Music",video photo maker studio,,5000000,143,,DigiArt: Cartoon For 3D Effect,东莞市水滴互娱网络科技有限公司,,500000
2019,2511415,144,-72,Blur Image Background Editor,Prinext,,5000000,144,-83,PLOTAVERSE • Creative Apps Kit,"PLOTAGRAPH, Inc.",,500000
2019,106717,145,-50,Videoshop - Video Editor,Jajijujejo Inc.,,5000000,145,-95,Patternator Video Wallpapers,Bazaart Ltd.,,500000
2019,6798580,146,93,Adobe Express: Graphic Design,Adobe,,5000000,146,,Made - Story Maker & Collage,Instasize Inc.,,500000
2019,13662719,147,133,BandLab – Music Making Studio,BandLab Technologies,,5000000,147,,Photopia: Cartoon Photo Editor,NEWVISION MOBILE TECHNOLOGY LIMITED,,500000
2019,2490734,148,,Square Fit - Blur Photo Editor,CameraStudiopro,,5000000,148,35,Filmr video editor by invideo,"Stei App, ltda",,500000
2019,4361935,149,-2,Photo Collage - Collageable,IRONTECH LIMITED,,5000000,149,-32,Totsie – Baby Photo Editor,Burleigh Creative,,500000
2019,6051507,150,165,Cutout background photo editor,Photo Collage Photo Editor,,5000000,150,-64,Glitché: Photo & Video Editor,Glitche Ltd.,,500000
2019,12966773,151,,VFly: video editor&video maker,Nanosoft,,5000000,151,-61,"Intro Music Video, Movie Maker",Khue Nguyen,,500000
2019,130262,152,,Background Eraser Photo Editor,VIDEOSHOW Video Editor & Maker & AI Chat Generator,,5000000,152,-63,ElfYourself®,Magic Mirror LLC,,500000
2019,540805,153,-80,Pitu - Best selfie and PS Soft,Shenzhen Tencent Tianyou Technology Ltd,,5000000,153,14,"PhotoGrid: Video & Pic Collage Maker, Photo Editor",Cheetah Technology Corporation Limited,,500000
2019,5927023,154,-78,VUE - vlog &amp; video editor,"VUE VIDEO CO., LTD.",,5000000,154,-77,Spectrum Photo Editor Vintage,AppCraft LLC,,500000
2019,7190902,155,,Selfie Art - Photo Editor,Amila Mobile Limited,,5000000,155,,Flipagram ·,Md Salim Bashar,,500000
2019,6784141,156,-82,PIP CAM - Photo Maker,Pic Tools Group (Photo Editor& Photo Grid&Collage),,5000000,156,-64,Mixoo:Pic Collage&Grid Maker,"Xi'an Button Software Technology Co., Ltd.",,500000
2019,218314,157,-30,Add Background Music To Video,"Easy Tiger Apps, LLC.",,5000000,157,-30,Logo Maker | Design Creator.,Logo Maker LLC,,500000
2019,6077842,158,,Glitch Photo Editor & Glitch V,Photo Editor & Collage Maker,,5000000,158,82,MAKEOVER - Body photo editor,Appyfurious LLC,,500000
2019,111380,159,776,Video Editor ·,Luni,,5000000,159,-88,"MOLDIV - Photo Editor, Collage",JellyBus Inc.,,500000
2019,108879,160,-46,Photo Editor,dev.macgyver,,5000000,160,-63,Perfect365 Makeup Photo Editor,"Perfect365, Inc.",,500000
2019,5779440,161,,"Cut Photo Editor Background Changer, Photo Filters",Lukas Podolskies,,5000000,161,144,Adobe Premiere Rush：Edit Video,Adobe,,500000
2019,219462,162,,Auto blur: blur background,Judi Studio,,5000000,162,4,Photo Editor-,Axiem Systems,,500000
2019,6698068,163,28,Music Video Maker,Best Photo Editor,,5000000,163,,Piczoo2-Filters for pictures*,"Xi'an Button Software Technology Co., Ltd.",,500000
2019,6096313,164,78,Police Suit Photo & Image Edit,App Basic,,5000000,164,-35,VaporCam－Retro Filter Camera,微咔世纪,,500000
2019,8426256,165,204,Video Editor with Music Filmix,Pro Video Editor & Music Video Maker Photo Collage,,5000000,165,20,Mematic - The Meme Maker,Theodor Mueller,,500000
2019,6047142,166,-63,AI Art Photo Editor: Selfie AI,Mivo studio,,5000000,166,-70,Video Editor@,IAPPTECHNOLOGIES LLP,,500000
2019,105658,167,,Love video maker with music,Photo frame intira,,5000000,167,20,Infltr - Infinite Filters,Yooshr Ltd,,500000
2019,9399327,168,24,Frame,Cheer Up Studio,,5000000,168,,Presets for Lightroom - FLTR,Onelight Apps CY Ltd,,500000
2019,6821458,169,,DOUPAI - DOUPAI FACE,BIG HEAD BROTHERS,,5000000,169,,咔咔视频制作-卡点快闪生成器,婉霞 夏,,200000
2019,8117319,170,-31,Slow motion video fast&slow mo,Bizo Mobile,,5000000,170,60,YouCam Makeup - Selfie Editor,PERFECT MOBILE CORP.,,200000
2019,8700065,171,-135,Selfie Camera - Beauty Camera & Photo Editor,Pic Tools Group (Photo Editor& Photo Grid&Collage),,5000000,171,-9,Intro Maker- yt intro designer,caihan caihan,,200000
2019,14090,172,-86,Photo Editor & Photo Frames: W,App Basic,,5000000,172,93,Photoshop Express Photo Editor,Adobe,,200000
2019,7808046,173,-29,Cut Paste Photos,Dexati,,5000000,173,-42,Poster Maker: Flyer Designer!,Poster App LLP,,200000
2019,228060,174,199,Nature Photo Frame - AI Backgr,ClickLab Technology,,5000000,174,-66,Videorama Text & Video Editor,Life Fertility Tracker IVS,,200000
2019,220601,175,1,Love Collage - Photo Editor,eToolkit Inc,,5000000,175,-5,Split Pic Collage Maker Layout,"Easy Tiger Apps, LLC.",,200000
2019,5779260,176,,Photolift - Face & Body Editor,Mimoza Bilgi Teknolojileri Limited Sirketi,,5000000,176,189,RetroCam: Vintage Film Camera,Fitness Labs,,200000
2019,6454209,177,96,"Bazaart: Design, Photo & Video",Bazaart Ltd.,,5000000,177,,fixtouch - retouch & makeup,Fitbest Bilgi Teknolojileri A.S.,,200000
2019,211769,178,94,Name Photo On Birthday Cake,Vedmetè App & Video Downloader,,5000000,178,-40,Logo Maker | Vintage Creator,LOGOFLY LLC,,200000
2019,173608,179,,"Photo Editor PRO: Photo Collage, Picture Editor",Clover Technology,,5000000,179,35,Magic Eraser Background Editor,Alan Cushway,,200000
2019,6700840,180,34,Collage Maker - Mixgram,Lyam Apps,,5000000,180,-98,Werble: Photo & Video Animator,Horsie in the Hedge Limited,,200000
2019,6096643,181,455,Photo video maker,music video photo maker,,5000000,181,-126,Huji Cam,"Manhole, Inc.",,200000
2019,7969719,182,34,最美证件照-证件照制作&智能抠图换底色,Hextek,,5000000,182,-56,PhotoDirector: AI Photo Editor,Cyberlink Corp,,200000
2019,10518097,183,-82,Funny Face Changer Warp Camera,VysionApps,,5000000,183,,飞推(趣推) - 创意视频制作神器,TAK BO TRADING DEVELOP LIMITED,,200000
2019,5864108,184,518,Creative Photo Frame : Prank,Appwallet Technologies,,5000000,184,-35,换发型-发型设计与脸型搭配软件,Tongbin Guo,,200000
2019,6178986,185,-92,Pixlr – Photo Editor,Pixlr,,5000000,185,113,Pop Dreams,BRAVO TECHNOLOGY ENTERPRISE LIMITED,,200000
2019,85233,186,-64,SlideShow Maker Photo to Video,Free Photo Video Editor And Picture Movie Editing Pte. Ltd.,,5000000,186,-54,Pixl: Face & Red Eye Corrector,Fitness Labs,,200000
2019,13709,187,528,Photo Wobble Editor - Jellify,Vacuapps s. r. o.,,5000000,187,-67,Audio Editor Tool: Edit Music,Music Breath,,200000
2019,752030,188,348,Man Hairstyle Photo Editor,Devkrushna Infotech Private Limited,,5000000,188,-75,intoLive - Live Wallpapers,"ImgBase, Inc.",,200000
2019,7120865,189,55,MP3 Cutter and Ringtone Maker,recorder & smart apps,,5000000,189,,Like Followers’ Cool Profile,Suo Ma,,200000
2019,5693387,190,572,Vlog Star - video editor,cerdillac,,5000000,190,-71,字说 - 文字动画视频神器,大发 方,,200000
2019,5771715,191,15,Filmmaker Pro - Video Editor,Tinkerworks Apps,,5000000,191,-63,Desygner: Graphic Design Maker,Desygner Pty Ltd,,200000
2019,6654937,192,,Photo Video Maker With Music,AmericaDev,,2000000,192,,Magic Followers&#39;Story Memories,Mollie Blake,,200000
2019,4122823,193,120,PICNIC - Weather Genie Photo,ESTsoft Corp.,,2000000,193,-19,KUNI Cam,GinnyPix,,200000
2019,2538665,194,-57,Photo Collage Editor,MeiHillMan,,2000000,194,134,Loopsie: AI Art Generator,KRNL SRL,,200000
2019,6202601,195,74,Background Remover Pro Eraser,Appwallet Technologies,,2000000,195,-84,ProKnockOut-Cut Paste Photos,"Shenzhen Qianhai Happy Tour Network Technology Co., Ltd.",,200000
2019,43840,196,569,MAGE - Musical Video FX,cerdillac,,2000000,196,-80,MIX - Photo Editor & Filters,灏 徐,,200000
2019,6059374,197,78,Text on Photo - Text Art,Eco Mobile,,2000000,197,-76,Photo Retouch-Object Removal,"Shenzhen Tushi Technology Co.,Ltd",,200000
2019,8013284,198,639,"Video Maker Of Photos & Effects, Slow Motion Video",Armel Bilton,,2000000,198,-153,Meipai,"Xiamen Meitu Technology Co., Ltd.",,200000
2019,5023971,199,-61,MIX - Photo Editor & Filters,灏 徐,,2000000,199,-63,Camera+: Pro Camera & Editor,"Heavy Plumb Apps, SOCIEDAD LIMITADA",,200000
2019,6792280,200,-76,VideoShow Video Editor & Maker,VIDEOSHOW PTE. LTD.,,2000000,200,,"Face Master-Face Aging, Face Scanner, Baby Filter",FaceTech.dev,,200000
2019,96209,201,-33,O2Cam: Take photos that breath,"Xiamen Meitu Technology Co., Ltd.",,2000000,201,-76,Cut Paste Photos Pro Edit Chop,Mesh Soft International LLP,,200000
2019,6096775,202,-89,AI Photo Editor Collage Maker,Snapcial™ - Photo Editor and Photo Collage Maker,,2000000,202,132,Photo Wonder,"Beijing Duyou Science and Technology Co.,Ltd.",,200000
